Acronym,Definition,Description,Tags,Grade
SOC,Security Operations Center,A facility that houses a team responsible for monitoring and analyzing an organization's security posture on an ongoing basis. SOC staff work with security technologies and processes to detect investigate respond to and prevent cybersecurity incidents protecting enterprise information systems.,Cybersecurity,4
SOCOM,Special Operations Command,A unified combatant command of the United States Department of Defense charged with overseeing the various special operations components of the U.S. Armed Forces. SOCOM trains conducts and ensures combat readiness of assigned forces carrying out special operations missions around the world.,Military,4
SOP,Standard Operating Procedure,A set of step-by-step instructions compiled by an organization to help workers carry out complex routine operations. SOPs aim to achieve efficiency quality output uniformity and regulatory compliance while reducing miscommunication and ensuring work is performed consistently regardless of who performs it.,Business,4
SQL,Structured Query Language,A programming language designed for managing and manipulating data in relational database management systems. SQL allows users to create retrieve update and delete data as well as design and modify database structures making it fundamental to most data-driven applications and organizations.,Technology,4
SSD,Solid State Drive,A storage device that uses integrated circuit assemblies to store data persistently typically using flash memory. SSDs are faster more reliable more energy-efficient and more resistant to physical shock than traditional hard disk drives though they generally offer less storage capacity per dollar.,Technology,4
SSL,Secure Sockets Layer,A standard security technology for establishing an encrypted link between a web server and a browser. SSL ensures that all data transmitted between the web server and browser remains private and secure preventing hackers from reading and modifying information during transmission.,Cybersecurity,4
SSRI,Selective Serotonin Reuptake Inhibitor,A class of medications primarily used to treat depression and anxiety disorders. SSRIs work by increasing levels of serotonin in the brain by blocking its reabsorption helping to improve mood regulate emotions and reduce anxiety symptoms with fewer side effects than older antidepressants.,Healthcare,4
STEM,Science Technology Engineering and Mathematics,An educational approach that integrates these four disciplines into a cohesive learning paradigm based on real-world applications. STEM education emphasizes problem-solving critical thinking innovation and the practical application of knowledge to prepare students for the demands of the modern workforce.,Education,4
SWIFT,Society for Worldwide Interbank Financial Telecommunication,A global member-owned cooperative that provides secure financial messaging services for international money transfers between banks. SWIFT facilitates standardized communication for financial transactions enabling reliable secure and efficient transfer of funds across borders.,Finance,4
SaaS,Software as a Service,A software licensing and delivery model where applications are hosted centrally and accessed by users via a web browser. SaaS eliminates the need for organizations to install and run applications on their own computers or data centers reducing IT infrastructure costs software maintenance responsibilities and initial setup expenses.,Technology,4
TCP,Transmission Control Protocol,A core communication protocol of the Internet Protocol Suite that provides reliable ordered and error-checked delivery of data between applications running on hosts communicating via an IP network. TCP ensures that data packets are delivered in the correct sequence without loss or duplication enabling stable internet communications.,Technology,4
TLS,Transport Layer Security,An encryption protocol designed to provide communications security over a computer network. TLS is the successor to SSL and provides secure communications on the internet for activities like web browsing email instant messaging and voice-over-IP ensuring data privacy and integrity.,Cybersecurity,4
TSA,Transportation Security Administration,An agency of the U.S. Department of Homeland Security that has authority over the security of the traveling public in the United States. TSA is primarily responsible for air travel security including passenger and baggage screening at airports to prevent terrorism and ensure safe transportation.,Transportation,4
UAV,Unmanned Aerial Vehicle,An aircraft without a human pilot aboard commonly known as a drone. UAVs are a component of an unmanned aircraft system which includes the aircraft ground-based controller and communications system used for military reconnaissance surveillance agriculture photography filmmaking and many other applications.,Technology,4
UI,User Interface,The space where interactions between humans and machines occur encompassing all visual auditory and physical ways a user interacts with a system. UI design focuses on anticipating user needs and ensuring that the interface has elements that are easy to access understand and use to facilitate those actions.,Design,4
UNESCO,United Nations Educational Scientific and Cultural Organization,A specialized agency of the United Nations aimed at promoting world peace and security through international cooperation in education the sciences and culture. UNESCO works to preserve cultural heritage advance universal education and foster scientific collaboration across borders.,International,4
UNICEF,United Nations Children's Fund,A United Nations agency responsible for providing humanitarian and developmental aid to children worldwide. UNICEF works in over 190 countries and territories to save children's lives defend their rights and help them fulfill their potential regardless of race religion or politics.,Humanitarian,4
URL,Uniform Resource Locator,A web address that specifies the location of a resource on the internet and the protocol used to access it. URLs provide a standardized way to locate and retrieve web pages documents and other resources online enabling navigation and linking across the internet.,Technology,4
USAF,United States Air Force,The aerial warfare service branch of the United States Armed Forces. USAF is responsible for military flying operations defensive strategic airpower global lift and reconnaissance in both peace and war supporting U.S. national security objectives through air and space superiority.,Military,4
USB,Universal Serial Bus,A standardized interface for connecting and communicating between computers and electronic devices. USB has largely replaced earlier interfaces due to its ease of use higher data transfer speeds and ability to provide power to connected devices while maintaining backward compatibility across generations.,Technology,4
USDA,United States Department of Agriculture,A federal department responsible for developing and executing federal laws related to farming forestry rural economic development and food. USDA oversees food safety inspection agricultural research conservation efforts nutrition programs and rural development initiatives to support American agriculture.,Government,4
USMC,United States Marine Corps,A branch of the United States Armed Forces responsible for conducting expeditionary and amphibious operations. USMC serves as a rapid reaction force ready for immediate deployment by sea or air to protect American interests and provide humanitarian assistance around the world.,Military,4
UX,User Experience,The overall experience of a person using a product service or system including perceptions of utility ease of use efficiency and overall satisfaction. UX design focuses on enhancing user satisfaction by improving the usability accessibility and pleasure provided in the interaction with a product or service.,Design,4
VPN,Virtual Private Network,A service that encrypts internet traffic and disguises online identity by hiding IP addresses. VPNs establish secure connections between remote computers and networks over the internet enabling private browsing anonymous online activity secure remote access and protection from surveillance or censorship.,Technology,4
VoIP,Voice over Internet Protocol,A technology that allows voice calls to be made using an internet connection instead of a traditional phone line. VoIP converts voice into digital signals that travel over the internet enabling cheaper international calls video conferencing and integration with other digital services.,Technology,4
WAF,Web Application Firewall,A firewall that monitors filters or blocks HTTP traffic to and from a web application. WAFs protect web applications from attacks such as cross-site forgery cross-site-scripting SQL injection and file inclusion providing a layer of protection between the internet and web applications.,Cybersecurity,4
WHO,World Health Organization,A specialized agency of the United Nations responsible for international public health. WHO coordinates international health work provides leadership on global health matters shapes health research sets norms and standards articulates policy options and monitors health trends worldwide.,Healthcare,4
WTO,World Trade Organization,The only global international organization dealing with the rules of trade between nations. WTO agreements are negotiated and signed by most of the world's trading nations and ratified in their parliaments with the goal of helping producers of goods and services exporters and importers conduct their business.,International,4
WWE,World Wrestling Entertainment,An American integrated media and entertainment company primarily known for professional wrestling. WWE has expanded into film American football and various other businesses with content broadcast in more than 150 countries and available in 30 languages blending sports and theatrical entertainment.,Entertainment,4
WiFi,Wireless Fidelity,A technology that allows electronic devices to connect to a wireless local area network using radio waves providing internet access and network connectivity without physical cables. WiFi enables mobility convenience and widespread internet access in homes businesses public spaces and virtually anywhere within range of a wireless network.,Technology,4
