Acronym,Definition,Description,Tags,Grade
ATCMS,Advanced Traffic Control and Management System,An intelligent transportation infrastructure that uses sensors data analytics and automation to optimize traffic flow and enhance road safety. ATCMS coordinates traffic signals manages lane usage provides real-time information to drivers and enables priority routing for emergency vehicles.,Transportation,4
ATM,Automated Teller Machine,An electronic banking device that allows customers to perform financial transactions without the need for human bank tellers. ATMs provide convenient 24/7 access to banking services including cash withdrawals deposits fund transfers and account inquiries using a secure card and PIN verification system.,Banking,4
ATP,Association of Tennis Professionals,The governing body of the men's professional tennis circuits. ATP organizes the worldwide tennis tour for men including the ATP Tour ATP Challenger Tour and ATP Champions Tour ranking players and establishing standards for tournaments and player conduct.,Sports,4
ATS,Applicant Tracking System,A software application that enables electronic handling of recruitment and hiring processes. ATS automates job posting resume screening candidate ranking and interview scheduling while providing analytics and compliance tools to streamline the talent acquisition process and improve hiring outcomes.,Human Resources,4
AWBM,Advanced Warehouse and Business Management,An integrated system for optimizing warehouse operations inventory control and related business processes. AWBM combines real-time tracking automated material handling predictive inventory management and business intelligence tools to enhance operational efficiency and supply chain performance.,Logistics,4
AWS,Amazon Web Services,A comprehensive cloud computing platform provided by Amazon that includes a mixture of infrastructure as a service platform as a service and packaged software as a service offerings. AWS provides computing power database storage content delivery and other functionality to help businesses scale and grow.,Technology,4
B2B,Business to Business,A type of commerce transaction that exists between businesses such as one involving a manufacturer and wholesaler or a wholesaler and a retailer. B2B transactions tend to occur in the supply chain where one company purchases raw materials from another to use in manufacturing.,Business,4
B2C,Business to Consumer,A sales model where businesses sell products or services directly to consumers. B2C companies typically sell finished goods or services directly to end users through retail stores online marketplaces or direct sales channels bypassing intermediaries in the distribution channel.,Business,4
BIM,Building Information Modeling,A process supported by various tools and technologies involving the generation and management of digital representations of physical and functional characteristics of places. BIM enables architecture engineering and construction professionals to efficiently plan design construct and manage buildings and infrastructure.,Architecture,4
BMI,Body Mass Index,A value derived from the mass and height of a person used as a screening tool to identify possible weight problems for adults. BMI is calculated by dividing a person's weight in kilograms by their height in meters squared providing a simple numeric measure of a person's thickness or thinness.,Healthcare,4
CAD,Computer-Aided Design,Software used by architects engineers and manufacturers to create precise 2D and 3D models of physical components and systems. CAD enables detailed visualization improved accuracy efficient design iterations documentation and integration with manufacturing processes across numerous industries.,Engineering,4
CAM,Computer-Aided Manufacturing,The use of software and computer-controlled machinery to automate manufacturing processes. CAM programs control machine tools for cutting milling turning and other operations enabling precise consistent production of complex parts with minimal human intervention.,Manufacturing,4
CAT,Computerized Axial Tomography,A medical imaging procedure that uses computer-processed combinations of many X-ray measurements taken from different angles to produce cross-sectional images of specific areas of a scanned object. CAT scans provide detailed images of internal organs bones soft tissue and blood vessels helping diagnose diseases injuries and abnormalities.,Healthcare,4
CBT,Cognitive Behavioral Therapy,A form of psychological treatment that has been demonstrated to be effective for a range of problems including depression anxiety disorders alcohol and drug use problems marital problems and severe mental illness. CBT focuses on changing negative thought patterns and behaviors to improve emotional regulation and develop coping strategies.,Psychology,4
CDC,Centers for Disease Control and Prevention,A national public health institute in the United States that works to protect public health and safety through the control and prevention of disease injury and disability. CDC conducts research provides health information responds to health emergencies and implements prevention strategies.,Government,4
CEO,Chief Executive Officer,The highest-ranking executive in a company responsible for major corporate decisions overall operations and resource management. The CEO serves as the primary communicator with the board of directors implements corporate vision and is ultimately accountable for the company's performance and direction.,Business,4
CERN,European Organization for Nuclear Research,A European research organization that operates the largest particle physics laboratory in the world. CERN's research explores the fundamental structure of the universe using complex scientific instruments including the Large Hadron Collider to study the basic constituents of matter and their interactions.,Science,4
CFO,Chief Financial Officer,The senior executive responsible for managing the financial actions of a company including tracking cash flow financial planning analyzing strengths and weaknesses and proposing strategic directions. CFOs oversee accounting departments manage financial risks and ensure regulatory compliance while supporting business growth.,Business,4
CIA,Central Intelligence Agency,The civilian foreign intelligence service of the United States government responsible for gathering processing and analyzing national security information from around the world. The CIA conducts covert operations and counterintelligence activities outside the United States to support national security objectives.,Government,4
CIO,Chief Information Officer,A senior executive responsible for managing implementing and usability of information and computer technologies within an organization. The CIO oversees IT strategy security operations and alignment with business goals ensuring that technology investments deliver value and competitive advantage.,Business,4
CISO,Chief Information Security Officer,A senior-level executive responsible for establishing and maintaining the enterprise vision strategy and program to ensure information assets and technologies are adequately protected. The CISO directs staff in identifying analyzing evaluating and mitigating information security risks.,Cybersecurity,4
CMMI,Capability Maturity Model Integration,A process level improvement training and appraisal program administered by the CMMI Institute. CMMI provides organizations with essential elements of effective processes to improve performance reduce costs increase operational predictability and elevate product quality across various domains.,Business,4
CMMS,Computerized Maintenance Management System,A software package that maintains a database of information about an organization's maintenance operations. CMMS helps maintenance teams keep track of assets preventive maintenance schedules work orders inventory management and equipment history to optimize maintenance activities and extend asset lifecycles.,Facilities,4
CMS,Content Management System,A software application used to create and manage digital content typically allowing multiple contributors to work in a collaborative environment. CMS platforms like WordPress Drupal and Joomla enable users to create edit publish and organize content without specialized technical knowledge.,Technology,4
CNC,Computer Numerical Control,A method for automating control of machine tools through the use of software embedded in a microcomputer attached to the tool. CNC machines execute precise pre-programmed sequences of machine control commands enabling consistent fabrication of complex parts with high precision and efficiency.,Manufacturing,4
COPD,Chronic Obstructive Pulmonary Disease,A chronic inflammatory lung disease that causes obstructed airflow from the lungs. COPD includes emphysema and chronic bronchitis is typically caused by long-term exposure to irritating gases or particulate matter and leads to symptoms such as breathing difficulty coughing wheezing and chest tightness.,Healthcare,4
CPI,Consumer Price Index,A measure that examines the weighted average of prices of a basket of consumer goods and services. CPI is used to track inflation and deflation periods identify cost-of-living changes and adjust wages benefits and prices to maintain purchasing power across the economy.,Economics,4
CPR,Cardiopulmonary Resuscitation,An emergency procedure combining chest compressions and artificial ventilation to maintain circulatory flow and oxygenation during cardiac arrest. CPR is performed to preserve brain function until further measures can be taken to restore spontaneous blood circulation and breathing in a person in cardiac arrest.,Healthcare,4
CPU,Central Processing Unit,"The primary component of a computer that performs most of the processing executing instructions performing calculations and managing data flow. Often referred to as the ""brain"" of the computer the CPU handles all the core computational tasks that enable a computer system to function.",Technology,4
CRISPR,Clustered Regularly Interspaced Short Palindromic Repeats,A revolutionary gene-editing technology that enables scientists to make precise changes to specific DNA sequences. CRISPR functions like genetic scissors allowing researchers to alter DNA sequences modify gene function and potentially treat genetic diseases offering unprecedented control over the genetic material of all living organisms.,Science,4
CRM,Customer Relationship Management,A technology for managing all company relationships and interactions with customers and potential customers. CRM systems help companies stay connected to customers streamline processes and improve profitability by organizing and automating communications sales and marketing functions.,Business,4
CSR,Corporate Social Responsibility,A self-regulating business model that aims to make a company socially accountable to itself its stakeholders and the public. CSR practices include environmental sustainability initiatives ethical labor practices philanthropic giving and community involvement demonstrating a commitment to social and environmental concerns.,Business,4
CSS,Cascading Style Sheets,A style sheet language used for describing the presentation of a document written in a markup language such as HTML. CSS separates content from design allowing developers to control layout colors fonts and other visual aspects of web pages improving accessibility and user experience.,Technology,4
CTO,Chief Technology Officer,A senior executive focused on scientific and technological issues within an organization. The CTO is responsible for overseeing technology development aligning technology investments with business goals and ensuring that technical resources are being used efficiently to solve business challenges.,Technology,4
DARPA,Defense Advanced Research Projects Agency,A research and development agency of the United States Department of Defense responsible for the development of emerging technologies for military use. DARPA pursues high-risk high-reward research initiatives to prevent and create strategic surprise enhancing national security through revolutionary advances in science and technology.,Military,4
DJIA,Dow Jones Industrial Average,A stock market index that measures the stock performance of 30 large companies listed on stock exchanges in the United States. The DJIA is one of the oldest and most followed equity indices serving as an indicator of the overall health of the U.S. economy and stock market performance.,Finance,4
DLP,Data Loss Prevention,A set of tools and processes used to ensure that sensitive data is not lost stolen or accessed by unauthorized users. DLP software identifies monitors and protects data in use in motion and at rest through content inspection context analysis and security measures across an organization.,Cybersecurity,4
DNA,Deoxyribonucleic Acid,A molecule composed of two polynucleotide chains that coil around each other to form a double helix carrying genetic instructions for the development functioning growth and reproduction of all known organisms. DNA contains the biological instructions that make each species unique and is essential for life and heredity.,Science,4
DNS,Domain Name System,The hierarchical and decentralized naming system used to identify computers reachable through the Internet or other IP networks. DNS translates human-readable domain names (like example.com) into numerical IP addresses needed for locating and identifying computer services and devices.,Technology,4
DOD,Department of Defense,The federal department charged with coordinating and supervising all agencies and functions of the government directly related to national security and the United States Armed Forces. DOD is the largest employer in the world overseeing the military branches and defense agencies that protect the United States.,Military,4
DOT,Department of Transportation,A federal Cabinet department of the U.S. government concerned with transportation. DOT oversees federal highway aviation railroad maritime and other transportation administration functions establishing safety standards developing transportation policies and providing financial grants for transportation projects.,Transportation,4
EAM,Enterprise Asset Management,The business processes and enabling information systems that support management of an organization's physical assets throughout their lifecycle. EAM encompasses planning acquisition operations maintenance disposal and performance analysis of assets to optimize their use performance cost and associated risks.,Business,4
ECC,Elliptic Curve Cryptography,A public-key cryptography system based on the algebraic structure of elliptic curves over finite fields. ECC requires smaller keys compared to non-EC cryptography to provide equivalent security making it useful for mobile applications digital signatures and other systems with limited computing resources.,Cybersecurity,4
ECG,Electrocardiogram,A test that records the electrical activity of the heart over a period of time using electrodes placed on the skin. ECGs detect heart problems analyze heart rhythms and monitor heart health providing critical information about cardiac function that helps in diagnosing and treating heart conditions.,Healthcare,4
EHR,Electronic Health Record,A comprehensive patient record that includes information from all clinicians involved in a patient's care and can be shared across different healthcare settings. EHRs contain medical history diagnoses medications treatment plans immunization dates allergies radiology images and laboratory test results.,Healthcare,4
EIA,Environmental Impact Assessment,A process of evaluating the likely environmental impacts of a proposed project or development taking into account socio-economic cultural and human-health impacts. EIA identifies potential environmental effects before implementation helping decision-makers develop environmentally sound and sustainable development.,Environment,4
EMR,Electronic Medical Record,A digital version of a patient's paper chart containing the medical and treatment history of patients from a single practice. EMRs allow clinicians to track data over time monitor patient health identify patterns and improve healthcare quality within their practice or organization.,Healthcare,4
ER,Emergency Room,A department in a hospital that provides immediate treatment for acute illnesses and trauma. ER offers 24-hour medical services for patients without prior appointment who require urgent care ranging from simple issues to life-threatening emergencies requiring immediate medical attention.,Healthcare,4
ERP,Enterprise Resource Planning,Business process management software that allows an organization to use a system of integrated applications to manage the business and automate many back-office functions. ERP systems integrate various organizational systems and facilitate error-free transactions and production improving efficiency and management reporting.,Business,4
ESA,European Space Agency,An intergovernmental organization dedicated to the exploration of space with 22 member states. ESA coordinates the financial and intellectual resources of its members to conduct space programs and activities beyond the capabilities of any single European country including satellite development launch services and planetary exploration.,Science,4
ESG,Environmental Social and Governance,A set of standards for a company's operations that socially conscious investors use to screen potential investments. ESG criteria consider how a corporation safeguards the environment manages relationships with employees suppliers customers and communities and handles leadership ethics and shareholder rights.,Business,4
ESL,English as a Second Language,Educational programs or methods used to teach English to non-native English speakers. ESL instruction focuses on developing reading writing speaking and listening skills for academic professional or personal contexts enabling non-native speakers to communicate effectively in English-speaking environments.,Education,4
ESPN,Entertainment and Sports Programming Network,A multinational basic cable sports channel owned by ESPN Inc. a joint venture between The Walt Disney Company and Hearst Communications. ESPN broadcasts primarily sports-related programming 24 hours a day including live and recorded event telecasts sports talk shows and other original programming.,Entertainment,4
ETA,Estimated Time of Arrival,The expected time at which a vehicle ship aircraft package or person will arrive at a specified destination. ETA provides important logistical information for transportation planning passenger expectations and supply chain management enabling coordination of resources and activities.,Transportation,4
ETF,Exchange-Traded Fund,A type of investment fund and exchange-traded product traded on stock exchanges. ETFs are similar to mutual funds but trade like stocks offering investors a way to pool their money in a fund that makes investments in stocks bonds or assets tracking an underlying index.,Finance,4
FAA,Federal Aviation Administration,A national authority with powers to regulate all aspects of civil aviation in the United States and its surrounding international waters. FAA oversees air traffic management aircraft certification commercial space transportation and development of the national aerospace system.,Transportation,4
FAQ,Frequently Asked Questions,A list of common questions and answers relating to a particular subject. FAQs provide efficient access to standard information addressing common concerns and reducing repetitive inquiries enabling users to find answers quickly without direct contact with customer support.,Communication,4
FBI,Federal Bureau of Investigation,The domestic intelligence and security service of the United States that serves as both a federal criminal investigative body and an internal intelligence agency. The FBI investigates terrorism counterintelligence cybercrime organized crime white-collar crime and major crimes across the country.,Government,4
FDA,Food and Drug Administration,A federal agency of the U.S. Department of Health and Human Services responsible for protecting public health. The FDA ensures the safety efficacy and security of human and veterinary drugs biological products medical devices food supply cosmetics and products that emit radiation.,Government,4
FDIC,Federal Deposit Insurance Corporation,A U.S. government corporation that provides deposit insurance to depositors in American commercial banks and savings institutions. FDIC coverage protects depositors against the loss of their insured deposits if an FDIC-insured bank or savings association fails up to $250000 per depositor per bank.,Finance,4
FEMA,Federal Emergency Management Agency,A U.S. agency responsible for coordinating the response to disasters that overwhelm local and state resources. FEMA provides emergency assistance supports citizens and first responders helps communities prepare for various hazards and assists in disaster recovery efforts.,Government,4
FERPA,Family Educational Rights and Privacy Act,A federal law that protects the privacy of student education records. FERPA gives parents certain rights with respect to their children's education records which transfer to the student when they reach 18 years old or attend a school beyond high school level.,Education,4
FICO,Fair Isaac Corporation,A data analytics company that produces the FICO score the most widely used consumer credit score for evaluating credit risk. FICO scores range from 300-850 and are calculated based on payment history amounts owed length of credit history new credit and credit mix helping lenders make billions of credit-related decisions annually.,Finance,4
FIFA,Fédération Internationale de Football Association,The international governing body of association football (soccer) futsal and beach soccer. FIFA is responsible for organizing and promoting major international soccer tournaments particularly the World Cup which is the world's most watched sporting event.,Sports,4
FSC,Forest Stewardship Council,An international non-profit organization that promotes responsible management of the world's forests. FSC sets standards for forest products creates certification systems and provides tracemarks ensuring that products come from responsibly managed forests that provide environmental social and economic benefits.,Environment,4
FYI,For Your Information,A phrase used when sharing information that might be useful or relevant but does not require any specific action. FYI commonly precedes emails memos or messages that are sent to keep others informed about developments without expecting a response or decision.,Communication,4
GAAP,Generally Accepted Accounting Principles,A common set of accounting principles standards and procedures that companies must follow when compiling financial statements. GAAP ensures consistency transparency and comparability in financial reporting making it possible for investors and creditors to make informed decisions based on standardized financial information.,Finance,4
GDPR,General Data Protection Regulation,A regulation in EU law on data protection and privacy for all individuals within the European Union and the European Economic Area. GDPR addresses the transfer of personal data outside the EU and EEA areas and gives individuals control over their personal data while simplifying the regulatory environment for international business.,Legal,4
GIS,Geographic Information System,A framework for gathering managing and analyzing geographic data. GIS integrates spatial information with database operations enabling users to visualize query analyze and interpret data to understand relationships patterns and trends related to geographic locations.,Technology,4
GPA,Grade Point Average,A standard scale measuring a student's average performance across all their academic courses. GPA is typically calculated on a 4.0 scale in the United States and is used for college admissions scholarship eligibility academic standing evaluation and graduate school applications.,Education,4
GPS,Global Positioning System,A satellite-based navigation system providing geolocation and time information to a GPS receiver anywhere on Earth with an unobstructed line of sight to four or more GPS satellites. GPS enables precise location tracking navigation and timing for military civilian and commercial applications worldwide.,Technology,4
GPU,Graphics Processing Unit,A specialized electronic circuit designed to rapidly manipulate and alter memory to accelerate the creation of images for output to a display device. GPUs excel at parallel processing making them ideal not only for graphics rendering but also for machine learning scientific computation and other tasks requiring massive parallel operations.,Technology,4
HBO,Home Box Office,An American premium cable and streaming television network that offers subscription-based video services primarily featuring films and original television series. HBO is known for high-quality original programming including dramas comedies documentaries and special events that have redefined television storytelling.,Entertainment,4
HIPAA,Health Insurance Portability and Accountability Act,A US federal law that provides data privacy and security provisions for safeguarding medical information. HIPAA establishes national standards to protect sensitive patient health information from being disclosed without the patient's consent or knowledge while enabling the flow of health information needed for quality care.,Healthcare,4
