Acronym,Definition,Description,Tags,Grade
AAITPC,American Association of Independent Tax Preparation Contractors,A professional organization that represents and advocates for independent tax preparers across the United States. AAITPC provides training resources regulatory updates and industry standards to help tax professionals maintain compliance and best practices.,Finance,4
AAWSE,Association for the Advancement of Women in Science and Engineering,An organization dedicated to supporting women in STEM fields through networking mentorship and educational initiatives. AAWSE works to increase representation of women in scientific and engineering disciplines through scholarships research opportunities and policy advocacy.,Education,4
ABA,Applied Behavior Analysis,A scientific approach to understanding behavior and how it is affected by the environment. ABA has been extensively used to help individuals with autism and other developmental disabilities acquire functional skills improve behaviors and develop independence through systematic assessment and intervention.,Psychology,4
ABCOA,Activity-Based Cost of Ownership Analysis,A financial methodology that evaluates the total cost of owning and operating an asset or system over its entire lifecycle. ABCOA provides detailed insights into direct and indirect costs helping organizations make more informed procurement and investment decisions.,Business,4
ABDCN,Australian Broadband Digital Communications Network,A telecommunications infrastructure initiative aimed at providing high-speed internet and digital communication services across Australia. ABDCN focuses on connecting rural and remote areas to reduce the digital divide and support economic development through improved connectivity.,Technology,4
ABFH,Automated Banking and Financial Hub,A centralized platform that integrates various banking services and financial operations into a single streamlined system. ABFH provides automated processing for transactions account management and financial reporting enabling more efficient and error-free banking operations.,Finance,4
ABM,Activity-Based Management,A methodology focused on analyzing the activities within an organization to identify and eliminate non-value-adding processes. ABM seeks to enhance operational efficiency and reduce costs by understanding the true drivers of business performance and reallocating resources accordingly.,Business,4
ABMPS,Automated Building Management and Protection Systems,An integrated system that monitors and controls various building operations including security environmental controls and maintenance schedules. ABMPS incorporates sensors automation and predictive analytics to optimize building performance safety and energy efficiency.,Technology,4
ABPMP,Association of Business Process Management Professionals,An international organization for business process management practitioners researchers and business leaders. ABPMP establishes standards provides certification programs and promotes best practices in process management to enhance organizational efficiency and effectiveness.,Business,4
ABSSI,Advanced Biometric Security Systems Integration,A comprehensive approach to implementing and coordinating multiple biometric security technologies within an organization's security infrastructure. ABSSI combines fingerprint facial recognition voice patterns and other biometric data to create layered authentication systems with enhanced security.,Security,4
ABWB,Association of Border Water Boards,An international collaborative body that coordinates water resource management across national boundaries. ABWB develops shared policies for water quality conservation cross-border water rights and flood control to ensure sustainable management of shared water resources.,Environment,4
ACC,Automated Cloud Computing,A system that manages cloud computing resources with minimal human intervention using AI and machine learning to optimize performance costs and security. ACC continuously monitors usage patterns automatically scales resources and implements best practices for cloud deployment and management.,Technology,4
ACCFL,Association of Community College Facilities Leaders,A professional organization for individuals responsible for planning designing maintaining and operating community college physical plants and facilities. ACCFL promotes excellence in facility management shares best practices and advocates for quality educational environments at community colleges.,Education,4
ACF,Advanced Composite Fabrication,A manufacturing process utilizing high-performance fiber-reinforced materials to create lightweight strong and durable components. ACF combines innovative materials with precision manufacturing techniques to produce parts for aerospace automotive and other industries requiring exceptional strength-to-weight ratios.,Manufacturing,4
ACH,Automated Clearing House,An electronic network for financial transactions in the United States that processes large volumes of credit and debit transactions in batches. ACH facilitates direct deposits payroll payments bill payments tax refunds and other electronic transfers between banks and financial institutions providing a reliable and efficient payment system.,Finance,4
ACM,Association for Computing Machinery,The world's largest educational and scientific computing society that delivers resources to advance computing as a science and profession. ACM provides publications conferences special interest groups and professional development programs for those in the computing field.,Technology,4
ACORNS,Automated Community Outreach and Resource Navigation System,A digital platform designed to connect vulnerable populations with available community services and support programs. ACORNS uses intelligent matching algorithms to identify relevant resources based on individual needs and facilitates streamlined access to housing healthcare and social services.,Social Services,4
ACSNET,Advanced Cybersecurity Network,A robust infrastructure designed to protect digital assets through multiple layers of security protocols detection systems and response mechanisms. ACSNET incorporates threat intelligence real-time monitoring and automated countermeasures to defend against evolving cyber threats across organizational networks.,Cybersecurity,4
ACT,American College Testing,A standardized test for high school achievement and college admissions in the United States. The ACT test covers four academic skill areas: English mathematics reading and science reasoning along with an optional writing test that assesses students' skills in planning and writing a short essay.,Education,4
ADBMT,Adaptive Database Management Technology,A flexible approach to database systems that automatically optimizes structure performance and security based on usage patterns and data characteristics. ADBMT incorporates machine learning to continuously refine query processing data storage and access controls for optimal database operation.,Technology,4
ADHD,Attention Deficit Hyperactivity Disorder,A neurodevelopmental disorder characterized by persistent patterns of inattention hyperactivity and impulsivity that interferes with functioning or development. ADHD affects both children and adults impacting academic performance work productivity and social relationships through difficulties with focus task completion and self-regulation.,Healthcare,4
ADICD,Association for Diversity and Inclusion in Community Development,An organization promoting equitable and inclusive approaches to urban planning community revitalization and neighborhood development. ADICD advocates for policies and practices that ensure diverse communities have meaningful input in development decisions that affect their neighborhoods and quality of life.,Urban Planning,4
ADLSC,Advanced Digital Library Sciences Consortium,A collaborative research initiative focused on developing next-generation digital library technologies and standards. ADLSC works on digital preservation metadata frameworks knowledge organization systems and accessibility tools to enhance the utility and sustainability of digital collections.,Information Science,4
AES,Advanced Encryption Standard,A specification for the encryption of electronic data established by the U.S. National Institute of Standards and Technology. AES is a symmetric block cipher chosen by the U.S. government to protect classified information and is implemented in software and hardware throughout the world for sensitive data protection.,Cybersecurity,4
AESFST,Association for Environmental Science and Sustainable Food Systems Technology,An organization dedicated to advancing environmentally responsible technologies and practices in food production processing and distribution. AESFST conducts research develops standards and promotes innovations that enhance food security while minimizing environmental impacts.,Agriculture,4
AFBMT,Advanced Financial Blockchain Management Technologies,A suite of tools and protocols leveraging blockchain technology for secure transparent and efficient financial transactions and record-keeping. AFBMT includes smart contracts automated compliance verification and distributed ledger systems that enhance financial operations while reducing fraud and administrative costs.,Finance,4
AFIRS,Automated Flight Information Reporting System,An aviation technology that automatically collects and transmits aircraft operational data to ground stations in real-time. AFIRS provides critical information about aircraft performance system status and flight parameters enabling proactive maintenance better operational decisions and enhanced safety.,Aviation,4
AGNBI,Association for Global Networked Business Innovation,An international organization that facilitates collaboration between businesses researchers and policymakers to advance innovative business models in a connected global economy. AGNBI promotes knowledge sharing cross-border partnerships and the development of standards for digital business ecosystems.,Business,4
AGRISAT,Agricultural Remote Imaging and Satellite Analysis Technologies,A suite of satellite-based tools that monitor agricultural lands providing detailed data on crop health soil conditions water usage and weather patterns. AGRISAT enables precision farming techniques optimized resource allocation and early detection of issues like disease or drought increasing agricultural efficiency and sustainability.,Agriculture,4
AI,Artificial Intelligence,The simulation of human intelligence in machines that are programmed to think and learn like humans. AI systems analyze data perceive their environment and take actions to achieve specific goals encompassing various technologies including machine learning natural language processing computer vision and expert systems.,Technology,4
AICOM,Artificial Intelligence for Communication Management,A system that uses AI to optimize organizational communications across multiple channels platforms and stakeholders. AICOM analyzes communication patterns automates routine messaging personalizes content based on recipient preferences and provides insights to improve overall communication effectiveness.,Technology,4
AIDS,Acquired Immunodeficiency Syndrome,A chronic potentially life-threatening condition caused by the human immunodeficiency virus (HIV). AIDS occurs when HIV infection severely damages the immune system leaving the body vulnerable to opportunistic infections and certain cancers that take advantage of a weakened immune system.,Healthcare,4
AIMRT,Advanced Integrated Medical Radiation Technology,A specialized medical system that combines various forms of radiation-based treatments with precision imaging and computerized planning. AIMRT delivers highly targeted radiation therapy for cancer treatment minimizing damage to healthy tissues while maximizing therapeutic effects through personalized treatment protocols.,Healthcare,4
AIOPS,Artificial Intelligence for IT Operations,A technology approach that combines big data machine learning and automation to enhance IT operations management. AIOPS systems continuously monitor IT infrastructure identify patterns anticipate problems and either automatically resolve issues or provide decision support for human operators.,Technology,4
AIPROS,Artificial Intelligence-Powered Recruitment and Onboarding System,A comprehensive HR platform that leverages AI to streamline and enhance the hiring and employee integration process. AIPROS automates candidate screening matches skills to job requirements facilitates interview scheduling and personalizes onboarding workflows while reducing bias and improving hiring outcomes.,Human Resources,4
AISES,American Indian Science and Engineering Society,A national nonprofit organization focused on increasing representation of Indigenous Americans in STEM fields. AISES provides scholarships mentorship internship opportunities and networking events to support Native American students and professionals in science technology engineering and mathematics careers.,Education,4
AITCN,Advanced Integrated Transportation and Communications Network,A sophisticated infrastructure system that coordinates various transportation modes with real-time communication and data exchange capabilities. AITCN optimizes traffic flow enhances safety improves logistics and provides passengers with seamless multi-modal transportation options through integrated digital technologies.,Transportation,4
AJBES,Association of Japanese Business and Economic Studies,An academic organization promoting research education and dialogue on Japanese business practices economic policies and international trade relationships. AJBES organizes conferences publishes research and facilitates exchange programs to advance understanding of Japan's business environment and economic systems.,Business,4
ALDMA,Association of Learning and Development Management Administrators,A professional organization for individuals responsible for overseeing and implementing corporate and institutional training and development programs. ALDMA establishes best practices provides certification programs and advocates for effective approaches to workforce development through continuous learning initiatives.,Education,4
ALS,Amyotrophic Lateral Sclerosis,A progressive neurodegenerative disease that affects nerve cells in the brain and spinal cord. ALS causes the death of neurons controlling voluntary muscles leading to stiff muscles muscle twitching and gradually worsening weakness resulting in difficulty speaking swallowing and eventually breathing.,Healthcare,4
ALSA,Advanced Life Support Association,A professional organization dedicated to improving critical care and emergency medical services through education research and advocacy. ALSA develops protocols provides advanced certification programs and promotes evidence-based practices for medical professionals who deliver life-saving care in emergency situations.,Healthcare,4
AMAHS,Association of Medical Administrative Health Specialists,A professional organization representing healthcare administrators medical office managers and health information professionals. AMAHS provides certification programs continuing education resources and advocacy to enhance the management and administrative operations of healthcare facilities.,Healthcare,4
AMCOP,Advanced Manufacturing and Computational Optimization Platform,An integrated system that combines advanced manufacturing technologies with computational modeling and simulation to optimize production processes. AMCOP enables digital twins predictive quality control and automated process refinement to enhance manufacturing efficiency quality and flexibility.,Manufacturing,4
ANEOS,Advanced Network for Earth Observation Systems,A collaborative infrastructure that connects and integrates various earth monitoring technologies including satellites ground sensors and aerial platforms. ANEOS provides comprehensive data on climate conditions natural resources environmental changes and potential hazards to support scientific research policy decisions and emergency management.,Environment,4
ANSI,American National Standards Institute,A private non-profit organization that oversees the development of voluntary consensus standards for products services processes systems and personnel in the United States. ANSI facilitates the development of standards by accrediting procedures used by standard setting organizations ensuring quality safety and efficiency across industries.,Standards,4
ANSOP,Association of National Satellite Operations Professionals,An international organization for professionals involved in satellite operations management and control. ANSOP establishes technical standards provides specialized training and facilitates knowledge sharing to ensure safe efficient and coordinated operation of satellite systems across national and organizational boundaries.,Aerospace,4
AOBFM,Association of Online Banking and Financial Marketplaces,A professional organization representing digital banking platforms and financial technology providers. AOBFM develops security standards promotes consumer protection measures and advocates for regulatory frameworks that support innovation while maintaining safety and integrity in online financial services.,Finance,4
APA,American Psychological Association,A scientific and professional organization representing psychology in the United States that also develops standards for academic and professional writing. APA style is widely used for formatting research papers citations references and other academic documents particularly in social sciences.,Education,4
APEC,Asia-Pacific Economic Cooperation,A regional economic forum established to leverage the growing interdependence of the Asia-Pacific region. APEC facilitates economic growth regional cooperation and trade among the 21 Pacific Rim member economies aiming to create greater prosperity by promoting balanced inclusive sustainable innovative and secure growth.,International,4
API,Application Programming Interface,A set of protocols and tools that allow different software applications to communicate with each other. APIs enable software integration by defining methods for various components to interact serving as building blocks for modern software development and digital ecosystems.,Technology,4
APICS,Association for Supply Chain Management,A professional association for supply chain operations and management professionals. APICS provides education certification programs and standards for efficient and effective supply chain practices focusing on planning sourcing manufacturing delivery and return processes across industries.,Business,4
APMSWS,Automated Process Management System for Web Services,A software framework that coordinates and optimizes the delivery and management of web-based services across an organization's digital infrastructure. APMSWS monitors service performance automates resource allocation and orchestrates workflows between different web applications to enhance reliability efficiency and user experience.,Technology,4
APRA,Association of Professional Risk Analysts,An international organization for professionals specializing in risk assessment management and mitigation across various sectors. APRA develops methodologies provides certification programs and establishes standards for identifying analyzing and addressing risks in financial operational strategic and compliance domains.,Finance,4
APSD,Automated Public Safety Dispatch,A comprehensive emergency response system that uses advanced algorithms and real-time data to optimize the deployment of police fire and emergency medical services. APSD automatically prioritizes calls routes the appropriate resources and provides responders with critical information to improve response times and effectiveness.,Public Safety,4
APTCM,Advanced Precision Temperature Control Mechanisms,Sophisticated systems designed to maintain precise temperature conditions in sensitive environments such as laboratories manufacturing facilities data centers and medical settings. APTCM integrates sensors feedback loops and adaptive controls to ensure stable and accurate temperature management for critical processes.,Engineering,4
ARBS,Automated Retail Banking System,A comprehensive digital platform that manages and executes retail banking operations with minimal human intervention. ARBS handles account management transaction processing loan applications and customer service inquiries using AI and rule-based automation to increase efficiency and reduce errors in everyday banking functions.,Banking,4
ARCP,Advanced Resource Capacity Planning,A methodology and system for optimizing the allocation and utilization of resources including personnel equipment facilities and materials across an organization. ARCP uses predictive analytics historical data and simulation models to align resource availability with project demands and organizational objectives.,Business,4
ARTS,Association for Retail Technology Standards,An organization that develops and promotes open technology standards for the retail industry. ARTS creates frameworks and protocols for point-of-sale systems inventory management customer data handling and retail analytics that enable interoperability efficiency and innovation across the retail technology ecosystem.,Retail,4
ASAP,As Soon As Possible,A commonly used business term indicating urgency and requesting immediate attention or priority handling of a task. ASAP communicates that something needs to be done at the earliest opportunity often implying that other tasks should be deprioritized to accommodate the urgent request.,Business,4
ASBDE,Association of State Boards of Dental Examiners,A national organization comprising regulatory boards that oversee dental practice licensing and standards. ASBDE facilitates coordination between state dental boards promotes uniform standards for dental education and practice and supports initiatives to protect public health through proper dental practice regulation.,Healthcare,4
ASBIS,Automated Scanning and Biometric Identification System,A security technology that uses automated scanning devices and algorithms to capture analyze and match biometric data for identity verification. ASBIS enables rapid accurate identification for access control border security and law enforcement applications while maintaining data privacy and security protocols.,Security,4
ASCLD,American Society of Crime Laboratory Directors,A professional organization for leaders who manage forensic science laboratories and services. ASCLD promotes excellence in forensic science through leadership education advocacy and the development of laboratory standards to ensure quality and integrity in criminal investigations and evidence analysis.,Legal,4
ASD,Autism Spectrum Disorder,A complex developmental condition involving persistent challenges with social communication restricted interests and repetitive behavior. ASD affects how people perceive and socialize with others causing challenges in social interaction and communication with varied types and severity of symptoms.,Healthcare,4
ASEAN,Association of Southeast Asian Nations,A regional intergovernmental organization comprising ten countries in Southeast Asia that promotes intergovernmental cooperation and facilitates economic integration amongst its members. ASEAN works to enhance economic growth social progress cultural development and regional stability while providing a mechanism for dispute resolution.,International,4
ASECA,Association of Securities Exchange Compliance Administrators,A professional organization for executives responsible for regulatory compliance at securities exchanges and trading platforms. ASECA develops best practices provides training programs and advocates for effective market surveillance and enforcement measures to maintain fair and orderly securities markets.,Finance,4
ASIC,Application-Specific Integrated Circuit,A microchip designed for a specific application rather than general-purpose use. ASICs are custom-designed at the transistor level for particular functions offering superior performance power efficiency and security for specialized applications like cryptocurrency mining telecommunications or AI processing.,Technology,4
ASME,American Society of Mechanical Engineers,A professional association promoting the art science and practice of mechanical engineering. ASME develops codes and standards provides continuing education and fosters innovation in engineering fields ranging from aerospace and automotive to manufacturing and bioengineering.,Engineering,4
ASPCA,American Society for the Prevention of Cruelty to Animals,A non-profit organization dedicated to preventing animal cruelty through direct intervention rescue operations and advocacy. ASPCA provides animal welfare services education resources and legislative advocacy to protect animals from abuse neglect and exploitation across the United States.,Animal Welfare,4
ASTM,American Society for Testing and Materials,A global organization that develops and publishes voluntary consensus technical standards for a wide range of materials products systems and services. ASTM standards enhance product quality improve safety facilitate market access and advance public health across numerous industries worldwide.,Standards,4
ATC,Air Traffic Control,A service provided by ground-based air traffic controllers who direct aircraft on the ground and through controlled airspace. ATC maintains safe distances between aircraft prevents collisions organizes and expedites the flow of air traffic and provides information and support for pilots.,Transportation,4
