Acronym,Definition,Description,Tags,Grade
HIV,Human Immunodeficiency Virus,A virus that attacks the body's immune system specifically the CD4 cells (T cells) which help the immune system fight off infections. If left untreated HIV reduces the number of CD4 cells in the body making it harder to fight off infections and disease and can lead to AIDS.,Healthcare,4
HPV,Human Papillomavirus,A group of related viruses that can cause warts and various types of cancer including cervical vulvar vaginal penile anal and oropharyngeal cancers. HPV is the most common sexually transmitted infection globally with most sexually active people contracting at least one type during their lifetime.,Healthcare,4
HTML,Hypertext Markup Language,The standard markup language for documents designed to be displayed in a web browser. HTML defines the structure and content of web pages using various elements and tags that browsers interpret to render text images links and other content on screen.,Technology,4
HVAC,Heating Ventilation and Air Conditioning,A system that provides heating and cooling services to buildings ensuring comfortable temperature and indoor air quality. HVAC systems include components for air circulation filtration humidity control and temperature maintenance designed to provide thermal comfort and acceptable indoor air quality.,Engineering,4
ICU,Intensive Care Unit,A specialized department of a hospital that provides intensive care medicine for critically ill patients. ICU offers advanced monitoring equipment specialized care from trained medical professionals continuous observation and advanced life support systems for patients with life-threatening conditions.,Healthcare,4
IDS,Intrusion Detection System,A device or software application that monitors a network or systems for malicious activity or policy violations. IDS systems collect and analyze information from various areas within a computer or network to identify possible security breaches which include attacks from outside and within the organization.,Cybersecurity,4
IEP,Individualized Education Program,A written document developed for each public school child who is eligible for special education. The IEP is created through a team effort and reviewed at least once a year to ensure it meets a student's unique educational needs and helps them make progress in school.,Education,4
IFRS,International Financial Reporting Standards,A set of accounting standards developed by the International Accounting Standards Board that provides a global framework for how public companies prepare and disclose their financial statements. IFRS promotes transparency accountability and efficiency in global financial markets by standardizing financial reporting.,Finance,4
IMAP,Internet Message Access Protocol,A standard email protocol that stores email messages on a mail server and enables the end user to view and manipulate the messages as though they were stored locally. IMAP allows users to access their email from multiple devices while maintaining the same view of their messages folders and message status.,Technology,4
IMAX,Image Maximum,A proprietary system of high-resolution cameras film formats projectors and theaters known for much larger screens and superior audio quality. IMAX provides an immersive cinematic experience with expanded aspect ratio enhanced clarity and precise sound creating a premium viewing environment for films and documentaries.,Entertainment,4
IMF,International Monetary Fund,An international organization that promotes global economic growth and financial stability encourages international trade and reduces poverty around the world. IMF provides policy advice and financing to members in economic difficulties while working with developing nations to achieve macroeconomic stability and reduce poverty.,Economics,4
INTERPOL,International Criminal Police Organization,An intergovernmental organization that facilitates international police cooperation. INTERPOL enables police around the world to work together to make the world a safer place through technical support operational assistance crime-fighting expertise and global databases.,Law Enforcement,4
IPS,Intrusion Prevention System,A network security technology that examines network traffic flows to detect and prevent vulnerability exploits. IPS works by actively scanning and analyzing suspicious content for threats and taking automatic actions when threats are detected such as dropping malicious packets blocking traffic or resetting connections.,Cybersecurity,4
IRS,Internal Revenue Service,The U.S. federal agency responsible for collecting taxes and administering the Internal Revenue Code. The IRS processes tax returns issues refunds enforces tax laws and provides assistance to taxpayers in understanding and meeting their tax obligations.,Government,4
ISO,International Organization for Standardization,An independent non-governmental international organization that develops and publishes standards across a vast range of industries and technologies. ISO standards ensure quality safety efficiency and interoperability of products systems and services facilitating international trade and fostering global consistency in various domains.,Standards,4
ISP,Internet Service Provider,A company that provides services for accessing and using the internet. ISPs offer various services such as internet access domain name registration web hosting email services and colocation managing the infrastructure that enables individuals and organizations to connect to the global internet.,Technology,4
IVF,In Vitro Fertilization,A complex series of procedures used to help with fertility or prevent genetic problems and assist with the conception of a child. IVF involves retrieving mature eggs from ovaries fertilizing them with sperm in a lab and implanting the embryos in a uterus to establish a pregnancy.,Healthcare,4
IoT,Internet of Things,A system of interrelated computing devices mechanical and digital machines provided with unique identifiers and the ability to transfer data over a network without requiring human-to-human or human-to-computer interaction. IoT connects everyday objects to the internet enabling smart homes industrial automation and new services.,Technology,4
JSOC,Joint Special Operations Command,A component command of the United States Special Operations Command and is charged to study special operations requirements and techniques to ensure standardized training and equipment planning and conducting special operations exercises and training and developing joint special operations tactics.,Military,4
KPI,Key Performance Indicator,A measurable value that demonstrates how effectively a company is achieving key business objectives. KPIs evaluate success at reaching targets and help organizations understand performance relative to strategic goals enabling better decision-making resource allocation and operational improvements.,Business,4
LAN,Local Area Network,A computer network that interconnects computers within a limited area such as a residence school laboratory university campus or office building. LANs enable resource sharing between computers quick data exchange and communication within an organization while providing higher security and data transfer rates than wider networks.,Technology,4
LCA,Life Cycle Assessment,A technique to assess environmental impacts associated with all stages of a product's life from raw material extraction through processing manufacturing distribution use and disposal or recycling. LCA helps identify opportunities to improve environmental performance throughout the product lifecycle.,Environment,4
LEED,Leadership in Energy and Environmental Design,A widely used green building rating system that provides a framework for healthy highly efficient and cost-saving green buildings. LEED certification is a globally recognized symbol of sustainability achievement and leadership providing third-party verification of green building features and performance.,Architecture,4
ML,Machine Learning,A subset of artificial intelligence that provides systems the ability to automatically learn and improve from experience without being explicitly programmed. ML focuses on the development of computer programs that can access data and use it to learn for themselves adapting algorithms through training data to make better predictions.,Technology,4
MLA,Modern Language Association,A scholarly organization that develops standards for academic writing primarily in the humanities. MLA style provides guidelines for citing sources and formatting papers in academic writing ensuring proper attribution of ideas and helping readers locate the sources used in scholarly work.,Education,4
MLB,Major League Baseball,A professional baseball organization and the oldest major professional sports league in the world. MLB consists of 30 teams (29 in the United States and 1 in Canada) that compete in the American League and National League representing the highest level of professional baseball.,Sports,4
MMA,Mixed Martial Arts,A full-contact combat sport that allows a wide variety of fighting techniques from a mixture of martial arts traditions and non-traditions. MMA incorporates striking and grappling while both standing and on the ground from various combat sports and martial arts around the world.,Sports,4
MOOC,Massive Open Online Course,An online course aimed at unlimited participation and open access via the web. MOOCs provide interactive courses with user forums to support community interactions among students professors and teaching assistants offering a wide range of subjects from top universities and institutions worldwide.,Education,4
MRI,Magnetic Resonance Imaging,A medical imaging technique that uses a magnetic field and computer-generated radio waves to create detailed images of the organs and tissues within the body. MRI produces high-resolution images without radiation exposure allowing doctors to diagnose conditions that might not be adequately assessed with other imaging methods like X-rays or CT scans.,Healthcare,4
MRSA,Methicillin-Resistant Staphylococcus Aureus,A type of staph bacteria that has developed resistance to many antibiotics used to treat ordinary staph infections. MRSA causes infections that are difficult to treat can spread in healthcare settings community environments and through direct contact making it a significant public health concern.,Healthcare,4
MTV,Music Television,A cable television channel originally launched with a focus on music videos that has evolved to include reality programming and other youth-oriented entertainment. MTV has been influential in popular culture music fashion and youth-focused television since its launch in 1981.,Entertainment,4
MVP,Most Valuable Player,An award given to the best-performing player in an entire league team or competition. MVP recognizes the player who has contributed the most to their team's success through outstanding performance leadership and overall impact on games throughout a season or tournament.,Sports,4
NAFTA,North American Free Trade Agreement,A trade agreement between Canada Mexico and the United States that eliminated most tariffs and barriers to free trade and investment. NAFTA created one of the world's largest free trade zones laying the groundwork for strong economic growth and helping to raise the standard of living for people across North America.,Economics,4
NASA,National Aeronautics and Space Administration,The U.S. government agency responsible for the civilian space program as well as aeronautics and space research. NASA leads America's space exploration efforts including missions to explore Earth the Moon Mars and beyond while advancing scientific understanding through research and technological innovation.,Science,4
NASDAQ,National Association of Securities Dealers Automated Quotations,An American stock exchange known for its high-tech listings and the world's first electronic stock market. NASDAQ is the second-largest stock exchange globally by market capitalization featuring many technology companies and providing an alternative to traditional floor trading through its all-electronic trading platform.,Finance,4
NATO,North Atlantic Treaty Organization,A military alliance between 30 North American and European countries established after World War II. NATO constitutes a system of collective defense whereby its member states agree to mutual defense in response to an attack by an external party promoting democratic values and enabling members to consult and cooperate on defense and security issues.,International,4
NAVY,United States Navy,The naval warfare service branch of the United States Armed Forces responsible for conducting naval operations around the world. Navy maintains ships aircraft submarines and other assets for war maintains freedom of the seas and protects U.S. interests abroad.,Military,4
NBA,National Basketball Association,The premier men's professional basketball league in North America composed of 30 teams. NBA is widely considered to be the premier men's professional basketball league in the world featuring many of the world's most talented players and serving as the global standard for basketball competition.,Sports,4
NCAA,National Collegiate Athletic Association,A member-led organization dedicated to the well-being and lifelong success of college athletes. NCAA regulates competitions provides scholarships establishes eligibility standards and enforces rules for athletic programs at member colleges and universities across the United States.,Sports,4
NFL,National Football League,The major professional American football league consisting of 32 teams divided equally between the National Football Conference and the American Football Conference. NFL is one of the four major North American professional sports leagues and the highest professional level of American football in the world.,Sports,4
NHL,National Hockey League,A professional ice hockey league in North America currently comprising 32 teams—25 in the United States and 7 in Canada. NHL is considered to be the premier professional ice hockey league in the world and one of the major professional sports leagues in the United States and Canada.,Sports,4
NIH,National Institutes of Health,The primary agency of the United States government responsible for biomedical and public health research. NIH conducts its own scientific research and provides funding for research at universities and other institutions contributing to important medical discoveries and improving human health.,Science,4
NLP,Natural Language Processing,A branch of artificial intelligence that helps computers understand interpret and manipulate human language. NLP enables computers to read decipher understand and make sense of human languages in a valuable way combining computational linguistics with statistical machine learning and deep learning models.,Technology,4
NOAA,National Oceanic and Atmospheric Administration,A scientific and regulatory agency within the United States Department of Commerce that forecasts weather monitors oceanic and atmospheric conditions and charts the seas. NOAA warns of dangerous weather provides environmental stewardship conducts research and manages coastal and marine ecosystems.,Science,4
NPV,Net Present Value,A method used to determine the current value of all future cash flows generated by a project including the initial capital investment. NPV is a core component of corporate budgeting that helps companies determine whether a project will yield a positive return and how it compares to alternative investments.,Finance,4
NSF,National Science Foundation,A U.S. government agency that supports fundamental research and education in all non-medical fields of science and engineering. NSF funds approximately 24 percent of all federally supported basic research conducted by America's colleges and universities promoting scientific progress and advancing knowledge.,Science,4
NTSB,National Transportation Safety Board,An independent U.S. government investigative agency responsible for civil transportation accident investigation. NTSB investigates accidents in aviation highways marine pipeline and railroad determines probable causes and issues safety recommendations aimed at preventing future accidents.,Transportation,4
NYSE,New York Stock Exchange,The world's largest stock exchange by market capitalization located on Wall Street in New York City. NYSE facilitates the buying and selling of stocks bonds and other securities providing liquidity price discovery and capital formation for companies and investors worldwide.,Finance,4
OCD,Obsessive-Compulsive Disorder,A mental health condition characterized by uncontrollable recurring thoughts (obsessions) and behaviors (compulsions) that a person feels the urge to repeat over and over. OCD features a pattern of unwanted thoughts and fears that lead to repetitive behaviors interfering with daily activities and causing significant distress.,Healthcare,4
OPEC,Organization of the Petroleum Exporting Countries,An intergovernmental organization of 13 nations that coordinates petroleum policies among member countries. OPEC aims to secure fair prices for petroleum producers a steady supply to consumers and a fair return on capital for industry investors while regulating oil production and price stabilization.,Economics,4
OSHA,Occupational Safety and Health Administration,A U.S. federal agency responsible for ensuring safe and healthful working conditions by setting and enforcing standards and providing training education and assistance. OSHA works to prevent workplace injuries illnesses and fatalities through regulations inspections and educational initiatives.,Safety,4
PDM,Product Data Management,A business function that manages and publishes product data with the goal of helping organizations to develop successful products. PDM systems store and organize engineering data provide controlled access manage change processes and maintain relationships between different pieces of product information.,Engineering,4
PKI,Public Key Infrastructure,A framework for managing digital certificates and public-key encryption that enables secure electronic transfer of information. PKI creates issues renews and revokes digital certificates binding public keys with user identities providing authentication integrity and non-repudiation for electronic communications.,Cybersecurity,4
PLC,Programmable Logic Controller,An industrial digital computer that has been ruggedized and adapted for the control of manufacturing processes such as assembly lines robotic devices or any activity that requires high reliability and ease of programming. PLCs monitor inputs and make decisions based on custom programming to control outputs in automated systems.,Engineering,4
PLM,Product Lifecycle Management,A strategic business approach that supports the collaborative creation management dissemination and use of product information across the extended enterprise. PLM integrates people processes business systems and information to manage the complete product lifecycle from conception through disposal.,Business,4
PPC,Pay Per Click,An internet advertising model used to drive traffic to websites where an advertiser pays a publisher when the ad is clicked. PPC allows advertisers to place ads in search engine results social media platforms and on other websites paying only when a user actually clicks through providing a measurable return on investment.,Marketing,4
PPI,Producer Price Index,A family of indexes that measures the average change over time in selling prices received by domestic producers for their output. PPI tracks price changes from the perspective of the seller serving as an early indicator of inflation before changes affect consumers and helping businesses with contract negotiations.,Economics,4
PTSD,Post-Traumatic Stress Disorder,A psychiatric disorder that can occur in people who have experienced or witnessed a traumatic event. PTSD symptoms include intrusive memories nightmares severe anxiety and uncontrollable thoughts about the event often significantly impairing daily functioning and quality of life for those affected.,Healthcare,4
QR,Quick Response,A type of matrix barcode first designed for the automotive industry that contains information about the item to which it is attached. QR codes can be read quickly by digital devices and store much more information than standard barcodes enabling fast tracking product identification marketing website linking and contactless payments.,Technology,4
RAM,Random Access Memory,Computer memory that can be read and changed in any order typically used to store working data and machine code. RAM provides fast temporary data storage for currently running programs but loses its stored information when power is removed making it essential for computer performance but not for permanent storage.,Technology,4
REIT,Real Estate Investment Trust,A company that owns operates or finances income-generating real estate. REITs allow individual investors to earn dividends from real estate investments without having to buy manage or finance properties themselves providing portfolio diversification and reliable income streams.,Finance,4
RFID,Radio-Frequency Identification,A technology that uses electromagnetic fields to automatically identify and track tags attached to objects. RFID systems consist of small tags containing electronically stored information and readers that collect this data wirelessly enabling applications in inventory tracking asset management access control and payment systems.,Technology,4
RFP,Request for Proposal,A document that solicits proposal services through a bidding process from potential vendors or service providers. RFPs outline project requirements objectives scope timeline evaluation criteria and contractual terms helping organizations identify the most qualified vendor for their specific needs.,Business,4
RFQ,Request for Quotation,A standard business process whose purpose is to invite suppliers into a bidding process to bid on specific products or services. RFQs include exact specifications of the items or services being requested allowing vendors to provide accurate pricing for direct comparison.,Business,4
RNA,Ribonucleic Acid,A polymeric molecule essential in various biological roles including coding decoding regulation and expression of genes. RNA is structurally similar to DNA but differs in chemical composition functions in cellular protein synthesis and carries genetic information in some viruses like the coronavirus.,Science,4
ROA,Return on Assets,A financial ratio that shows the percentage of profit a company earns in relation to its overall resources. ROA indicates how efficiently a company is using its assets to generate profits enabling investors and managers to assess the company's operational efficiency and financial performance.,Finance,4
ROI,Return on Investment,A performance measure used to evaluate the efficiency or profitability of an investment relative to its cost. ROI is calculated by dividing the benefit (return) of an investment by the cost of the investment and is used by businesses and individuals to compare the efficiency of different investment options.,Finance,4
RSVP,Répondez S'il Vous Plaît,"A French phrase meaning ""please respond"" commonly included on invitations. RSVP requests that invitees notify the host of their intention to attend or not attend allowing for accurate planning of space food and other arrangements for social or business events.",Communication,4
SAT,Scholastic Assessment Test,A standardized test widely used for college admissions in the United States. The SAT measures literacy numeracy and writing skills needed for academic success in college and provides colleges with one common data point that can be used to compare all applicants.,Education,4
SCADA,Supervisory Control and Data Acquisition,A system architecture that uses computers networked data communications and graphical user interfaces for high-level process management. SCADA systems collect real-time data monitor and control industrial processes and infrastructure in facilities such as power plants manufacturing facilities and utilities.,Industrial,4
SEC,Securities and Exchange Commission,The U.S. government agency responsible for enforcing federal securities laws and regulating the securities industry stock exchanges and companies offering securities to the public. SEC protects investors maintains fair and efficient markets and facilitates capital formation through oversight enforcement and regulation.,Finance,4
SEO,Search Engine Optimization,The process of improving a website to increase its visibility when people search for products or services. SEO involves making technical content and design changes to rank higher in search engine results pages attract more visitors and increase the likelihood of those visitors becoming customers.,Marketing,4
SIDS,Sudden Infant Death Syndrome,The unexplained death usually during sleep of a seemingly healthy baby less than a year old. SIDS is sometimes called crib death and remains a leading cause of death in infants despite recommended preventive measures like placing babies on their backs to sleep.,Healthcare,4
SMTP,Simple Mail Transfer Protocol,An internet standard communication protocol for electronic mail transmission. SMTP is used when sending emails between servers ensuring that messages are delivered to the correct destination through a series of commands that identify the sender recipient and message content.,Technology,4
