ID,Acronym,Definition,Description,Tags,Usage Examples,Related Terms,Slug,Meta Description,Views,Status,Price (USD),Grade,Custom Pricing,Custom Pricing Data,Category ID,Suggested Category,Submitted By,Created At,Updated At
,"ADWST","American Dental and Wellness Studies Training","A U.S. training program combining dental and wellness education. It prepares professionals for holistic oral health practices.","Dental, Wellness, Education",,,adwst/american-dental-and-wellness-studies-training,,0,Approved,$0,2,No,,,Dental Wellness,,2025-04-01T00:00:00Z,2025-04-01T00:00:00Z
,"AEA","American Evaluation Association","A U.S. professional organization for evaluators. It promotes evaluation practices and research across disciplines.","Evaluation, Professional Organization, Research",,,aea/american-evaluation-association,,0,Approved,$0,2,No,,,Evaluation,,2025-04-01T00:00:00Z,2025-04-01T00:00:00Z
,"AEACS","American Educators Association of Career Studies","A U.S. association for educators in career-focused programs. It supports training for workforce readiness.","Education, Career, Professional Organization",,,aeacs/american-educators-association-of-career-studies,,0,Approved,$0,2,No,,,Career Education,,2025-04-01T00:00:00Z,2025-04-01T00:00:00Z
,"AEAFS","American Educators Association of Forensic Studies","A U.S. association for educators in forensic sciences. It advances teaching in criminal justice and investigation.","Forensic, Education, Professional Organization",,,aeafs/american-educators-association-of-forensic-studies,,0,Approved,$0,2,No,,,Forensic Education,,2025-04-01T00:00:00Z,2025-04-01T00:00:00Z
,"AEAHS","American Educators Association of Health Studies","A U.S. association for health education professionals. It promotes teaching in healthcare and wellness.","Health, Education, Professional Organization",,,aeahs/american-educators-association-of-health-studies,,0,Approved,$0,2,No,,,Health Education,,2025-04-01T00:00:00Z,2025-04-01T00:00:00Z
,"AEAMS","American Educators Association of Management Studies","A U.S. association for management education professionals. It supports training in leadership and administration.","Management, Education, Professional Organization",,,aeams/american-educators-association-of-management-studies,,0,Approved,$0,2,No,,,Management Education,,2025-04-01T00:00:00Z,2025-04-01T00:00:00Z
,"AEAPS","American Educators Association of Psychological Studies","A U.S. association for educators in psychology. It advances teaching in mental health and behavior.","Psychology, Education, Professional Organization",,,aeaps/american-educators-association-of-psychological-studies,,0,Approved,$0,2,No,,,Psychology Education,,2025-04-01T00:00:00Z,2025-04-01T00:00:00Z
,"AEARS","American Educators Association of Rehabilitation Studies","A U.S. association for educators in rehabilitation. It supports training for patient recovery and care.","Rehabilitation, Education, Professional Organization",,,aears/american-educators-association-of-rehabilitation-studies,,0,Approved,$0,2,No,,,Rehabilitation Education,,2025-04-01T00:00:00Z,2025-04-01T00:00:00Z
,"AEASS","American Educators Association of Safety Studies","A U.S. association for safety education professionals. It promotes teaching in workplace and public safety.","Safety, Education, Professional Organization",,,aeass/american-educators-association-of-safety-studies,,0,Approved,$0,2,No,,,Safety Education,,2025-04-01T00:00:00Z,2025-04-01T00:00:00Z
,"AEC","American Engineering Council","A U.S. council representing engineering professionals. It advocates for engineering standards and education.","Engineering, Council, Professional Organization",,,aec/american-engineering-council,,0,Approved,$0,2,No,,,Engineering,,2025-04-01T00:00:00Z,2025-04-01T00:00:00Z
,"AECCS","American Engineering College of Computer Studies","A U.S. college offering computer engineering education. It trains students for careers in tech development.","Engineering, Computer, Education",,,aeccs/american-engineering-college-of-computer-studies,,0,Approved,$0,2,No,,,Computer Engineering,,2025-04-01T00:00:00Z,2025-04-01T00:00:00Z
,"AECES","American Engineering College of Environmental Studies","A U.S. college focused on environmental engineering education. It prepares students for sustainability solutions.","Engineering, Environment, Education",,,aeces/american-engineering-college-of-environmental-studies,,0,Approved,$0,2,No,,,Environmental Engineering,,2025-04-01T00:00:00Z,2025-04-01T00:00:00Z
,"AECMS","American Engineering College of Management Studies","A U.S. college combining engineering and management education. It trains leaders for technical industries.","Engineering, Management, Education",,,aecms/american-engineering-college-of-management-studies,,0,Approved,$0,2,No,,,Engineering Management,,2025-04-01T00:00:00Z,2025-04-01T00:00:00Z
,"AECSS","American Engineering College of Safety Studies","A U.S. college offering safety engineering education. It prepares professionals for hazard prevention.","Engineering, Safety, Education",,,aecss/american-engineering-college-of-safety-studies,,0,Approved,$0,2,No,,,Safety Engineering,,2025-04-01T00:00:00Z,2025-04-01T00:00:00Z
,"AECTS","American Engineering College of Transportation Studies","A U.S. college focused on transportation engineering education. It trains experts for infrastructure and logistics.","Engineering, Transportation, Education",,,aects/american-engineering-college-of-transportation-studies,,0,Approved,$0,2,No,,,Transportation Engineering,,2025-04-01T00:00:00Z,2025-04-01T00:00:00Z
,"AEDCS","American Educators of Dental College Studies","A U.S. group for educators in dental colleges. It supports teaching in oral healthcare.","Dental, Education, Professional Organization",,,aedcs/american-educators-of-dental-college-studies,,0,Approved,$0,2,No,,,Dental Education,,2025-04-01T00:00:00Z,2025-04-01T00:00:00Z
,"AEDHS","American Educators of Developmental Health Studies","A U.S. group for educators in developmental health. It advances teaching in child and lifespan health.","Health, Developmental, Education",,,aedhs/american-educators-of-developmental-health-studies,,0,Approved,$0,2,No,,,Developmental Health,,2025-04-01T00:00:00Z,2025-04-01T00:00:00Z
,"AEDMS","American Educators of Disaster Management Studies","A U.S. group for educators in disaster management. It supports training for crisis preparedness.","Disaster, Management, Education",,,aedms/american-educators-of-disaster-management-studies,,0,Approved,$0,2,No,,,Disaster Management,,2025-04-01T00:00:00Z,2025-04-01T00:00:00Z
,"AEDSS","American Educators of Disability Studies Services","A U.S. group for educators in disability studies. It promotes teaching for accessibility and support.","Disability, Education, Professional Organization",,,aedss/american-educators-of-disability-studies-services,,0,Approved,$0,2,No,,,Disability Studies,,2025-04-01T00:00:00Z,2025-04-01T00:00:00Z
,"AEE","American Earthquake Engineering","A U.S. organization focused on earthquake engineering research. It advances seismic safety in construction.","Engineering, Earthquake, Research",,,aee/american-earthquake-engineering,,0,Approved,$0,2,No,,,Earthquake Engineering,,2025-04-01T00:00:00Z,2025-04-01T00:00:00Z
,"AEEPS","American Educators of Emergency Preparedness Studies","A U.S. group for educators in emergency preparedness. It supports training for crisis response.","Emergency, Preparedness, Education",,,aeeps/american-educators-of-emergency-preparedness-studies,,0,Approved,$0,2,No,,,Emergency Preparedness,,2025-04-01T00:00:00Z,2025-04-01T00:00:00Z
,"AEERS","American Educators of Environmental Resource Studies","A U.S. group for educators in environmental resources. It promotes teaching in sustainability and ecology.","Environment, Resource, Education",,,aeers/american-educators-of-environmental-resource-studies,,0,Approved,$0,2,No,,,Environmental Education,,2025-04-01T00:00:00Z,2025-04-01T00:00:00Z
,"AEFCS","American Educators of Family Counseling Studies","A U.S. group for educators in family counseling. It advances training in family therapy and support.","Counseling, Family, Education",,,aefcs/american-educators-of-family-counseling-studies,,0,Approved,$0,2,No,,,Family Counseling,,2025-04-01T00:00:00Z,2025-04-01T00:00:00Z
,"AEFSS","American Educators of Forensic Safety Studies","A U.S. group for educators in forensic safety. It supports teaching in safety and legal investigations.","Forensic, Safety, Education",,,aefss/american-educators-of-forensic-safety-studies,,0,Approved,$0,2,No,,,Forensic Safety,,2025-04-01T00:00:00Z,2025-04-01T00:00:00Z
,"AEGCS","American Educators of Geriatric Counseling Studies","A U.S. group for educators in geriatric counseling. It promotes training for elderly mental health.","Counseling, Geriatric, Education",,,aegcs/american-educators-of-geriatric-counseling-studies,,0,Approved,$0,2,No,,,Geriatric Counseling,,2025-04-01T00:00:00Z,2025-04-01T00:00:00Z
,"AEGHS","American Educators of Global Health Studies","A U.S. group for educators in global health. It supports teaching in international healthcare issues.","Health, Global, Education",,,aeghs/american-educators-of-global-health-studies,,0,Approved,$0,2,No,,,Global Health,,2025-04-01T00:00:00Z,2025-04-01T00:00:00Z
,"AEHCS","American Educators of Health Counseling Studies","A U.S. group for educators in health counseling. It advances training in wellness and mental health.","Counseling, Health, Education",,,aehcs/american-educators-of-health-counseling-studies,,0,Approved,$0,2,No,,,Health Counseling,,2025-04-01T00:00:00Z,2025-04-01T00:00:00Z
,"AEHIS","American Educators of Health Information Studies","A U.S. group for educators in health information. It promotes teaching in medical data management.","Health, Information, Education",,,aehis/american-educators-of-health-information-studies,,0,Approved,$0,2,No,,,Health Information,,2025-04-01T00:00:00Z,2025-04-01T00:00:00Z
,"AEHMS","American Educators of Healthcare Management Studies","A U.S. group for educators in healthcare management. It supports training for healthcare administration.","Healthcare, Management, Education",,,aehms/american-educators-of-healthcare-management-studies,,0,Approved,$0,2,No,,,Healthcare Management,,2025-04-01T00:00:00Z,2025-04-01T00:00:00Z
,"AEHPS","American Educators of Health Psychology Studies","A U.S. group for educators in health psychology. It advances teaching in mental and physical health.","Psychology, Health, Education",,,aehps/american-educators-of-health-psychology-studies,,0,Approved,$0,2,No,,,Health Psychology,,2025-04-01T00:00:00Z,2025-04-01T00:00:00Z
,"AEHSS","American Educators of Human Safety Studies","A U.S. group for educators in human safety. It promotes teaching in personal and community safety.","Safety, Human, Education",,,aehss/american-educators-of-human-safety-studies,,0,Approved,$0,2,No,,,Safety Education,,2025-04-01T00:00:00Z,2025-04-01T00:00:00Z
,"AEICS","American Educators of Industrial Counseling Studies","A U.S. group for educators in industrial counseling. It supports training for workplace mental health.","Counseling, Industrial, Education",,,aeics/american-educators-of-industrial-counseling-studies,,0,Approved,$0,2,No,,,Industrial Counseling,,2025-04-01T00:00:00Z,2025-04-01T00:00:00Z
,"AEIMS","American Educators of Information Management Studies","A U.S. group for educators in information management. It advances teaching in data and IT systems.","Information, Management, Education",,,aeims/american-educators-of-information-management-studies,,0,Approved,$0,2,No,,,Information Management,,2025-04-01T00:00:00Z,2025-04-01T00:00:00Z
,"AEIPS","American Educators of Industrial Psychology Studies","A U.S. group for educators in industrial psychology. It promotes training in workplace behavior.","Psychology, Industrial, Education",,,aeips/american-educators-of-industrial-psychology-studies,,0,Approved,$0,2,No,,,Industrial Psychology,,2025-04-01T00:00:00Z,2025-04-01T00:00:00Z
,"AEIRS","American Educators of International Relations Studies","A U.S. group for educators in international relations. It supports teaching in global affairs.","International, Relations, Education",,,aeirs/american-educators-of-international-relations-studies,,0,Approved,$0,2,No,,,International Relations,,2025-04-01T00:00:00Z,2025-04-01T00:00:00Z
,"AEISS","American Educators of Information Safety Studies","A U.S. group for educators in information safety. It advances teaching in cybersecurity and data protection.","Safety, Information, Education",,,aeiss/american-educators-of-information-safety-studies,,0,Approved,$0,2,No,,,Information Safety,,2025-04-01T00:00:00Z,2025-04-01T00:00:00Z
,"AEJCS","American Educators of Juvenile Counseling Studies","A U.S. group for educators in juvenile counseling. It supports training for youth mental health.","Counseling, Juvenile, Education",,,aejcs/american-educators-of-juvenile-counseling-studies,,0,Approved,$0,2,No,,,Juvenile Counseling,,2025-04-01T00:00:00Z,2025-04-01T00:00:00Z
,"AEMCS","American Educators of Military Counseling Studies","A U.S. group for educators in military counseling. It promotes training for veteran and active-duty support.","Counseling, Military, Education",,,aemcs/american-educators-of-military-counseling-studies,,0,Approved,$0,2,No,,,Military Counseling,,2025-04-01T00:00:00Z,2025-04-01T00:00:00Z
,"AEMHS","American Educators of Mental Health Studies","A U.S. group for educators in mental health. It advances teaching in psychological well-being.","Mental Health, Education, Professional Organization",,,aemhs/american-educators-of-mental-health-studies,,0,Approved,$0,2,No,,,Mental Health Education,,2025-04-01T00:00:00Z,2025-04-01T00:00:00Z
,"AEMSS","American Educators of Medical Safety Studies","A U.S. group for educators in medical safety. It supports training for healthcare safety practices.","Medical, Safety, Education",,,aemss/american-educators-of-medical-safety-studies,,0,Approved,$0,2,No,,,Medical Safety,,2025-04-01T00:00:00Z,2025-04-01T00:00:00Z
,"AENCS","American Educators of Nutritional Counseling Studies","A U.S. group for educators in nutritional counseling. It promotes teaching in diet and health.","Counseling, Nutrition, Education",,,aencs/american-educators-of-nutritional-counseling-studies,,0,Approved,$0,2,No,,,Nutritional Counseling,,2025-04-01T00:00:00Z,2025-04-01T00:00:00Z
,"AENHS","American Educators of Natural Health Studies","A U.S. group for educators in natural health. It advances training in holistic wellness.","Health, Natural, Education",,,aenhs/american-educators-of-natural-health-studies,,0,Approved,$0,2,No,,,Natural Health,,2025-04-01T00:00:00Z,2025-04-01T00:00:00Z
,"AENSS","American Educators of National Safety Studies","A U.S. group for educators in national safety. It supports teaching in public and homeland security.","Safety, National, Education",,,aenss/american-educators-of-national-safety-studies,,0,Approved,$0,2,No,,,National Safety,,2025-04-01T00:00:00Z,2025-04-01T00:00:00Z
,"AEOCS","American Educators of Occupational Counseling Studies","A U.S. group for educators in occupational counseling. It promotes training for workplace mental health.","Counseling, Occupational, Education",,,aeocs/american-educators-of-occupational-counseling-studies,,0,Approved,$0,2,No,,,Occupational Counseling,,2025-04-01T00:00:00Z,2025-04-01T00:00:00Z
,"AEOHS","American Educators of Occupational Health Studies","A U.S. group for educators in occupational health. It supports teaching in workplace wellness.","Health, Occupational, Education",,,aeohs/american-educators-of-occupational-health-studies,,0,Approved,$0,2,No,,,Occupational Health,,2025-04-01T00:00:00Z,2025-04-01T00:00:00Z
,"AEOSS","American Educators of Operational Safety Studies","A U.S. group for educators in operational safety. It advances training in system and process safety.","Safety, Operational, Education",,,aeoss/american-educators-of-operational-safety-studies,,0,Approved,$0,2,No,,,Operational Safety,,2025-04-01T00:00:00Z,2025-04-01T00:00:00Z
,"AEPHS","American Educators of Public Health Studies","A U.S. group for educators in public health. It promotes teaching in community health practices.","Health, Public, Education",,,aephs/american-educators-of-public-health-studies,,0,Approved,$0,2,No,,,Public Health,,2025-04-01T00:00:00Z,2025-04-01T00:00:00Z
,"AEPSS","American Educators of Public Safety Studies","A U.S. group for educators in public safety. It supports training for community security.","Safety, Public, Education",,,aepss/american-educators-of-public-safety-studies,,0,Approved,$0,2,No,,,Public Safety,,2025-04-01T00:00:00Z,2025-04-01T00:00:00Z
,"AERCS","American Educators of Rehabilitation Counseling Studies","A U.S. group for educators in rehabilitation counseling. It advances training for patient recovery support.","Counseling, Rehabilitation, Education",,,aercs/american-educators-of-rehabilitation-counseling-studies,,0,Approved,$0,2,No,,,Rehabilitation Counseling,,2025-04-01T00:00:00Z,2025-04-01T00:00:00Z
,"AERHS","American Educators of Rural Health Studies","A U.S. group for educators in rural health. It promotes teaching in underserved healthcare.","Health, Rural, Education",,,aerhs/american-educators-of-rural-health-studies,,0,Approved,$0,2,No,,,Rural Health,,2025-04-01T00:00:00Z,2025-04-01T00:00:00Z
,"AERSS","American Educators of Rehabilitation Safety Studies","A U.S. group for educators in rehabilitation safety. It supports training for safe recovery practices.","Safety, Rehabilitation, Education",,,aerss/american-educators-of-rehabilitation-safety-studies,,0,Approved,$0,2,No,,,Rehabilitation Safety,,2025-04-01T00:00:00Z,2025-04-01T00:00:00Z
,"AESCS","American Educators of Supply Chain Studies","A U.S. group for educators in supply chain management. It advances teaching in logistics and distribution.","Supply Chain, Education, Professional Organization",,,aescs/american-educators-of-supply-chain-studies,,0,Approved,$0,2,No,,,Supply Chain,,2025-04-01T00:00:00Z,2025-04-01T00:00:00Z
,"AESHS","American Educators of Sports Health Studies","A U.S. group for educators in sports health. It promotes teaching in athlete wellness.","Health, Sports, Education",,,aeshs/american-educators-of-sports-health-studies,,0,Approved,$0,2,No,,,Sports Health,,2025-04-01T00:00:00Z,2025-04-01T00:00:00Z
,"AESSS","American Educators of Systems Safety Studies","A U.S. group for educators in systems safety. It supports training in technical safety systems.","Safety, Systems, Education",,,aesss/american-educators-of-systems-safety-studies,,0,Approved,$0,2,No,,,Systems Safety,,2025-04-01T00:00:00Z,2025-04-01T00:00:00Z
,"AETCS","American Educators of Transportation Counseling Studies","A U.S. group for educators in transportation counseling. It advances training for transport-related mental health.","Counseling, Transportation, Education",,,aetcs/american-educators-of-transportation-counseling-studies,,0,Approved,$0,2,No,,,Transportation Counseling,,2025-04-01T00:00:00Z,2025-04-01T00:00:00Z
,"AETHS","American Educators of Technical Health Studies","A U.S. group for educators in technical health. It promotes teaching in healthcare technology.","Health, Technical, Education",,,aeths/american-educators-of-technical-health-studies,,0,Approved,$0,2,No,,,Technical Health,,2025-04-01T00:00:00Z,2025-04-01T00:00:00Z
,"AETSS","American Educators of Transportation Safety Studies","A U.S. group for educators in transportation safety. It supports training for safe transport systems.","Safety, Transportation, Education",,,aetss/american-educators-of-transportation-safety-studies,,0,Approved,$0,2,No,,,Transportation Safety,,2025-04-01T00:00:00Z,2025-04-01T00:00:00Z
,"AEVCS","American Educators of Veteran Counseling Studies","A U.S. group for educators in veteran counseling. It advances training for veteran mental health support.","Counseling, Veteran, Education",,,aevcs/american-educators-of-veteran-counseling-studies,,0,Approved,$0,2,No,,,Veteran Counseling,,2025-04-01T00:00:00Z,2025-04-01T00:00:00Z
,"AEVHS","American Educators of Veterinary Health Studies","A U.S. group for educators in veterinary health. It promotes teaching in animal healthcare.","Veterinary, Health, Education",,,aevhs/american-educators-of-veterinary-health-studies,,0,Approved,$0,2,No,,,Veterinary Education,,2025-04-01T00:00:00Z,2025-04-01T00:00:00Z
,"AEWCS","American Educators of Workplace Counseling Studies","A U.S. group for educators in workplace counseling. It supports training for employee mental health.","Counseling, Workplace, Education",,,aewcs/american-educators-of-workplace-counseling-studies,,0,Approved,$0,2,No,,,Workplace Counseling,,2025-04-01T00:00:00Z,2025-04-01T00:00:00Z
,"AEWHS","American Educators of Workplace Health Studies","A U.S. group for educators in workplace health. It advances teaching in employee wellness programs.","Health, Workplace, Education",,,aewhs/american-educators-of-workplace-health-studies,,0,Approved,$0,2,No,,,Workplace Health,,2025-04-01T00:00:00Z,2025-04-01T00:00:00Z
,"AEWSS","American Educators of Workplace Safety Studies","A U.S. group for educators in workplace safety. It promotes training for occupational hazard prevention.","Safety, Workplace, Education",,,aewss/american-educators-of-workplace-safety-studies,,0,Approved,$0,2,No,,,Workplace Safety,,2025-04-01T00:00:00Z,2025-04-01T00:00:00Z
,"AF","American Federation","A generic term for U.S. federations uniting various groups. It represents collective interests across industries.","Federation, Professional Organization, Union",,,af/american-federation,,0,Approved,$0,2,No,,,Federation,,2025-04-01T00:00:00Z,2025-04-01T00:00:00Z
,"AFA","American Forestry Association","A U.S. organization promoting forestry and conservation. It supports sustainable forest management practices.","Forestry, Conservation, Professional Organization",,,afa/american-forestry-association,,0,Approved,$0,2,No,,,Forestry,,2025-04-01T00:00:00Z,2025-04-01T00:00:00Z
,"AFACS","American Federation of Addiction Counseling Studies","A U.S. federation for addiction counseling educators. It advances training in substance abuse recovery.","Counseling, Addiction, Federation",,,afacs/american-federation-of-addiction-counseling-studies,,0,Approved,$0,2,No,,,Addiction Counseling,,2025-04-01T00:00:00Z,2025-04-01T00:00:00Z
,"AFAFS","American Federation of Aviation Forensic Studies","A U.S. federation for aviation forensic educators. It supports training in crash investigation and safety.","Aviation, Forensic, Federation",,,afafs/american-federation-of-aviation-forensic-studies,,0,Approved,$0,2,No,,,Aviation Forensics,,2025-04-01T00:00:00Z,2025-04-01T00:00:00Z
,"AFAHS","American Federation of Allied Health Studies","A U.S. federation for allied health educators. It promotes training in healthcare support roles.","Health, Allied, Federation",,,afahs/american-federation-of-allied-health-studies,,0,Approved,$0,2,No,,,Allied Health,,2025-04-01T00:00:00Z,2025-04-01T00:00:00Z
,"AFAMS","American Federation of Aviation Management Studies","A U.S. federation for aviation management educators. It advances training in flight operations.","Aviation, Management, Federation",,,afams/american-federation-of-aviation-management-studies,,0,Approved,$0,2,No,,,Aviation Management,,2025-04-01T00:00:00Z,2025-04-01T00:00:00Z
,"AFAPS","American Federation of Aviation Psychology Studies","A U.S. federation for aviation psychology educators. It supports training in pilot mental health.","Psychology, Aviation, Federation",,,afaps/american-federation-of-aviation-psychology-studies,,0,Approved,$0,2,No,,,Aviation Psychology,,2025-04-01T00:00:00Z,2025-04-01T00:00:00Z
,"AFARS","American Federation of Aviation Rehabilitation Studies","A U.S. federation for aviation rehabilitation educators. It promotes training for injured aviation workers.","Rehabilitation, Aviation, Federation",,,afars/american-federation-of-aviation-rehabilitation-studies,,0,Approved,$0,2,No,,,Aviation Rehabilitation,,2025-04-01T00:00:00Z,2025-04-01T00:00:00Z
,"AFASS","American Federation of Aviation Safety Studies","A U.S. federation for aviation safety educators. It supports training in flight safety practices.","Safety, Aviation, Federation",,,afass/american-federation-of-aviation-safety-studies,,0,Approved,$0,2,No,,,Aviation Safety,,2025-04-01T00:00:00Z,2025-04-01T00:00:00Z
,"AFBCS","American Federation of Behavioral Counseling Studies","A U.S. federation for behavioral counseling educators. It advances training in behavior modification.","Counseling, Behavioral, Federation",,,afbcs/american-federation-of-behavioral-counseling-studies,,0,Approved,$0,2,No,,,Behavioral Counseling,,2025-04-01T00:00:00Z,2025-04-01T00:00:00Z
,"AFBHS","American Federation of Behavioral Health Studies","A U.S. federation for behavioral health educators. It promotes teaching in mental wellness.","Health, Behavioral, Federation",,,afbhs/american-federation-of-behavioral-health-studies,,0,Approved,$0,2,No,,,Behavioral Health,,2025-04-01T00:00:00Z,2025-04-01T00:00:00Z
,"AFBMS","American Federation of Biomedical Studies","A U.S. federation for biomedical educators. It supports training in medical technology.","Biomedical, Education, Federation",,,afbms/american-federation-of-biomedical-studies,,0,Approved,$0,2,No,,,Biomedical Studies,,2025-04-01T00:00:00Z,2025-04-01T00:00:00Z
,"AFBSS","American Federation of Biological Safety Studies","A U.S. federation for biological safety educators. It advances training in biohazard management.","Safety, Biological, Federation",,,afbss/american-federation-of-biological-safety-studies,,0,Approved,$0,2,No,,,Biological Safety,,2025-04-01T00:00:00Z,2025-04-01T00:00:00Z
