ID,Acronym,Definition,Description,Tags,Usage Examples,Related Terms,Slug,Meta Description,Views,Status,Price (USD),Grade,Custom Pricing,Custom Pricing Data,Category ID,Suggested Category,Submitted By,Created At,Updated At
,"AIA","American Institute of Architects","A U.S. professional organization for architects. It promotes excellence in architectural design and practice.","Architecture, Professional Organization, Design",,,aia/american-institute-of-architects,,0,Approved,$0,2,No,,,Architecture,,2025-04-01T00:00:00Z,2025-04-01T00:00:00Z
,"AIACS","American Institute of Addiction Counseling Studies","A U.S. institute for addiction counseling education. It trains professionals in substance abuse recovery.","Counseling, Addiction, Institute",,,aiacs/american-institute-of-addiction-counseling-studies,,0,Approved,$0,2,No,,,Addiction Counseling,,2025-04-01T00:00:00Z,2025-04-01T00:00:00Z
,"AIAFS","American Institute of Aviation Forensic Studies","A U.S. institute for aviation forensic education. It advances training in crash investigation.","Forensic, Aviation, Institute",,,aiafs/american-institute-of-aviation-forensic-studies,,0,Approved,$0,2,No,,,Aviation Forensics,,2025-04-01T00:00:00Z,2025-04-01T00:00:00Z
,"AIAHS","American Institute of Allied Health Studies","A U.S. institute for allied health education. It promotes training in healthcare support roles.","Health, Allied, Institute",,,aiahs/american-institute-of-allied-health-studies,,0,Approved,$0,2,No,,,Allied Health,,2025-04-01T00:00:00Z,2025-04-01T00:00:00Z
,"AIAMS","American Institute of Aviation Management Studies","A U.S. institute for aviation management education. It supports training in flight operations.","Management, Aviation, Institute",,,aiams/american-institute-of-aviation-management-studies,,0,Approved,$0,2,No,,,Aviation Management,,2025-04-01T00:00:00Z,2025-04-01T00:00:00Z
,"AIAPS","American Institute of Aviation Psychology Studies","A U.S. institute for aviation psychology education. It advances training in pilot mental health.","Psychology, Aviation, Institute",,,aiaps/american-institute-of-aviation-psychology-studies,,0,Approved,$0,2,No,,,Aviation Psychology,,2025-04-01T00:00:00Z,2025-04-01T00:00:00Z
,"AIARS","American Institute of Aviation Rehabilitation Studies","A U.S. institute for aviation rehabilitation education. It promotes training for injured aviation workers.","Rehabilitation, Aviation, Institute",,,aiars/american-institute-of-aviation-rehabilitation-studies,,0,Approved,$0,2,No,,,Aviation Rehabilitation,,2025-04-01T00:00:00Z,2025-04-01T00:00:00Z
,"AIASS","American Institute of Aviation Safety Studies","A U.S. institute for aviation safety education. It supports training in flight safety practices.","Safety, Aviation, Institute",,,aiass/american-institute-of-aviation-safety-studies,,0,Approved,$0,2,No,,,Aviation Safety,,2025-04-01T00:00:00Z,2025-04-01T00:00:00Z
,"AIBCS","American Institute of Behavioral Counseling Studies","A U.S. institute for behavioral counseling education. It advances training in behavior modification.","Counseling, Behavioral, Institute",,,aibcs/american-institute-of-behavioral-counseling-studies,,0,Approved,$0,2,No,,,Behavioral Counseling,,2025-04-01T00:00:00Z,2025-04-01T00:00:00Z
,"AIBHS","American Institute of Behavioral Health Studies","A U.S. institute for behavioral health education. It promotes teaching in mental wellness.","Health, Behavioral, Institute",,,aibhs/american-institute-of-behavioral-health-studies,,0,Approved,$0,2,No,,,Behavioral Health,,2025-04-01T00:00:00Z,2025-04-01T00:00:00Z
,"AIBMS","American Institute of Biomedical Studies","A U.S. institute for biomedical education. It supports training in medical technology.","Biomedical, Education, Institute",,,aibms/american-institute-of-biomedical-studies,,0,Approved,$0,2,No,,,Biomedical Studies,,2025-04-01T00:00:00Z,2025-04-01T00:00:00Z
,"AIBSS","American Institute of Biological Safety Studies","A U.S. institute for biological safety education. It advances training in biohazard management.","Safety, Biological, Institute",,,aibss/american-institute-of-biological-safety-studies,,0,Approved,$0,2,No,,,Biological Safety,,2025-04-01T00:00:00Z,2025-04-01T00:00:00Z
,"AIC","American Institute of Chemists","A U.S. professional organization for chemists. It promotes advancements in chemical sciences.","Chemistry, Professional Organization, Science",,,aic/american-institute-of-chemists,,0,Approved,$0,2,No,,,Chemistry,,2025-04-01T00:00:00Z,2025-04-01T00:00:00Z
,"AICCS","American Institute of Community Counseling Studies","A U.S. institute for community counseling education. It promotes training in local mental health.","Counseling, Community, Institute",,,aiccs/american-institute-of-community-counseling-studies,,0,Approved,$0,2,No,,,Community Counseling,,2025-04-01T00:00:00Z,2025-04-01T00:00:00Z
,"AICHS","American Institute of Community Health Studies","A U.S. institute for community health education. It supports teaching in public wellness.","Health, Community, Institute",,,aichs/american-institute-of-community-health-studies,,0,Approved,$0,2,No,,,Community Health,,2025-04-01T00:00:00Z,2025-04-01T00:00:00Z
,"AICMS","American Institute of Construction Management Studies","A U.S. institute for construction management education. It advances training in building projects.","Construction, Management, Institute",,,aicms/american-institute-of-construction-management-studies,,0,Approved,$0,2,No,,,Construction Management,,2025-04-01T00:00:00Z,2025-04-01T00:00:00Z
,"AICSS","American Institute of Correctional Safety Studies","A U.S. institute for correctional safety education. It supports training in prison security.","Safety, Correctional, Institute",,,aicss/american-institute-of-correctional-safety-studies,,0,Approved,$0,2,No,,,Correctional Safety,,2025-04-01T00:00:00Z,2025-04-01T00:00:00Z
,"AIDCS","American Institute of Disaster Counseling Studies","A U.S. institute for disaster counseling education. It promotes training for crisis mental health.","Counseling, Disaster, Institute",,,aidcs/american-institute-of-disaster-counseling-studies,,0,Approved,$0,2,No,,,Disaster Counseling,,2025-04-01T00:00:00Z,2025-04-01T00:00:00Z
,"AIDHS","American Institute of Developmental Health Studies","A U.S. institute for developmental health education. It advances teaching in lifespan wellness.","Health, Developmental, Institute",,,aidhs/american-institute-of-developmental-health-studies,,0,Approved,$0,2,No,,,Developmental Health,,2025-04-01T00:00:00Z,2025-04-01T00:00:00Z
,"AIDMS","American Institute of Disaster Management Studies","A U.S. institute for disaster management education. It supports training in emergency preparedness.","Disaster, Management, Institute",,,aidms/american-institute-of-disaster-management-studies,,0,Approved,$0,2,No,,,Disaster Management,,2025-04-01T00:00:00Z,2025-04-01T00:00:00Z
,"AIDSS","American Institute of Disability Safety Studies","A U.S. institute for disability safety education. It promotes training in accessibility and protection.","Safety, Disability, Institute",,,aidss/american-institute-of-disability-safety-studies,,0,Approved,$0,2,No,,,Disability Safety,,2025-04-01T00:00:00Z,2025-04-01T00:00:00Z
,"AIECS","American Institute of Environmental Counseling Studies","A U.S. institute for environmental counseling education. It supports training in eco-mental health.","Counseling, Environment, Institute",,,aiecs/american-institute-of-environmental-counseling-studies,,0,Approved,$0,2,No,,,Environmental Counseling,,2025-04-01T00:00:00Z,2025-04-01T00:00:00Z
,"AIEHS","American Institute of Environmental Health Studies","A U.S. institute for environmental health education. It advances teaching in ecological wellness.","Health, Environment, Institute",,,aiehs/american-institute-of-environmental-health-studies,,0,Approved,$0,2,No,,,Environmental Health,,2025-04-01T00:00:00Z,2025-04-01T00:00:00Z
,"AIEMS","American Institute of Emergency Management Studies","A U.S. institute for emergency management education. It promotes training in crisis response.","Emergency, Management, Institute",,,aiems/american-institute-of-emergency-management-studies,,0,Approved,$0,2,No,,,Emergency Management,,2025-04-01T00:00:00Z,2025-04-01T00:00:00Z
,"AIERS","American Institute of Emergency Response Studies","A U.S. institute for emergency response education. It supports training for rapid crisis intervention.","Emergency, Response, Institute",,,aiers/american-institute-of-emergency-response-studies,,0,Approved,$0,2,No,,,Emergency Response,,2025-04-01T00:00:00Z,2025-04-01T00:00:00Z
,"AIESS","American Institute of Environmental Safety Studies","A U.S. institute for environmental safety education. It advances training in ecological protection.","Safety, Environment, Institute",,,aiess/american-institute-of-environmental-safety-studies,,0,Approved,$0,2,No,,,Environmental Safety,,2025-04-01T00:00:00Z,2025-04-01T00:00:00Z
,"AIFCS","American Institute of Family Counseling Studies","A U.S. institute for family counseling education. It promotes training in family therapy.","Counseling, Family, Institute",,,aifcs/american-institute-of-family-counseling-studies,,0,Approved,$0,2,No,,,Family Counseling,,2025-04-01T00:00:00Z,2025-04-01T00:00:00Z
,"AIFHS","American Institute of Forensic Health Studies","A U.S. institute for forensic health education. It supports teaching in medical-legal fields.","Health, Forensic, Institute",,,aifhs/american-institute-of-forensic-health-studies,,0,Approved,$0,2,No,,,Forensic Health,,2025-04-01T00:00:00Z,2025-04-01T00:00:00Z
,"AIFSS","American Institute of Forensic Safety Studies","A U.S. institute for forensic safety education. It advances training in safety investigations.","Safety, Forensic, Institute",,,aifss/american-institute-of-forensic-safety-studies,,0,Approved,$0,2,No,,,Forensic Safety,,2025-04-01T00:00:00Z,2025-04-01T00:00:00Z
,"AIGCS","American Institute of Geriatric Counseling Studies","A U.S. institute for geriatric counseling education. It promotes training for elderly mental health.","Counseling, Geriatric, Institute",,,aigcs/american-institute-of-geriatric-counseling-studies,,0,Approved,$0,2,No,,,Geriatric Counseling,,2025-04-01T00:00:00Z,2025-04-01T00:00:00Z
,"AIGHS","American Institute of Global Health Studies","A U.S. institute for global health education. It supports teaching in international wellness.","Health, Global, Institute",,,aighs/american-institute-of-global-health-studies,,0,Approved,$0,2,No,,,Global Health,,2025-04-01T00:00:00Z,2025-04-01T00:00:00Z
,"AIHCS","American Institute of Health Counseling Studies","A U.S. institute for health counseling education. It advances training in wellness support.","Counseling, Health, Institute",,,aihcs/american-institute-of-health-counseling-studies,,0,Approved,$0,2,No,,,Health Counseling,,2025-04-01T00:00:00Z,2025-04-01T00:00:00Z
,"AIHMS","American Institute of Healthcare Management Studies","A U.S. institute for healthcare management education. It promotes training in medical administration.","Healthcare, Management, Institute",,,aihms/american-institute-of-healthcare-management-studies,,0,Approved,$0,2,No,,,Healthcare Management,,2025-04-01T00:00:00Z,2025-04-01T00:00:00Z
,"AIHPS","American Institute of Health Psychology Studies","A U.S. institute for health psychology education. It supports teaching in mental-physical health.","Psychology, Health, Institute",,,aihps/american-institute-of-health-psychology-studies,,0,Approved,$0,2,No,,,Health Psychology,,2025-04-01T00:00:00Z,2025-04-01T00:00:00Z
,"AIHSS","American Institute of Human Safety Studies","A U.S. institute for human safety education. It advances training in personal protection.","Safety, Human, Institute",,,aihss/american-institute-of-human-safety-studies,,0,Approved,$0,2,No,,,Human Safety,,2025-04-01T00:00:00Z,2025-04-01T00:00:00Z
,"AIICS","American Institute of Industrial Counseling Studies","A U.S. institute for industrial counseling education. It promotes training in workplace mental health.","Counseling, Industrial, Institute",,,aiics/american-institute-of-industrial-counseling-studies,,0,Approved,$0,2,No,,,Industrial Counseling,,2025-04-01T00:00:00Z,2025-04-01T00:00:00Z
,"AIIHS","American Institute of Industrial Health Studies","A U.S. institute for industrial health education. It supports teaching in occupational wellness.","Health, Industrial, Institute",,,aiihs/american-institute-of-industrial-health-studies,,0,Approved,$0,2,No,,,Industrial Health,,2025-04-01T00:00:00Z,2025-04-01T00:00:00Z
,"AIIMS","American Institute of Information Management Studies","A U.S. institute for information management education. It advances training in data systems.","Information, Management, Institute",,,aiims/american-institute-of-information-management-studies,,0,Approved,$0,2,No,,,Information Management,,2025-04-01T00:00:00Z,2025-04-01T00:00:00Z
,"AIIPS","American Institute of Industrial Psychology Studies","A U.S. institute for industrial psychology education. It promotes training in workplace behavior.","Psychology, Industrial, Institute",,,aiips/american-institute-of-industrial-psychology-studies,,0,Approved,$0,2,No,,,Industrial Psychology,,2025-04-01T00:00:00Z,2025-04-01T00:00:00Z
,"AIIRS","American Institute of International Relations Studies","A U.S. institute for international relations education. It supports teaching in global affairs.","International, Relations, Institute",,,aiirs/american-institute-of-international-relations-studies,,0,Approved,$0,2,No,,,International Relations,,2025-04-01T00:00:00Z,2025-04-01T00:00:00Z
,"AIISS","American Institute of Information Safety Studies","A U.S. institute for information safety education. It advances training in cybersecurity.","Safety, Information, Institute",,,aiiss/american-institute-of-information-safety-studies,,0,Approved,$0,2,No,,,Information Safety,,2025-04-01T00:00:00Z,2025-04-01T00:00:00Z
,"AIJCS","American Institute of Juvenile Counseling Studies","A U.S. institute for juvenile counseling education. It promotes training for youth mental health.","Counseling, Juvenile, Institute",,,aijcs/american-institute-of-juvenile-counseling-studies,,0,Approved,$0,2,No,,,Juvenile Counseling,,2025-04-01T00:00:00Z,2025-04-01T00:00:00Z
,"AIMCS","American Institute of Military Counseling Studies","A U.S. institute for military counseling education. It supports training for veteran mental health.","Counseling, Military, Institute",,,aimcs/american-institute-of-military-counseling-studies,,0,Approved,$0,2,No,,,Military Counseling,,2025-04-01T00:00:00Z,2025-04-01T00:00:00Z
,"AIMHS","American Institute of Mental Health Studies","A U.S. institute for mental health education. It advances teaching in psychological wellness.","Mental Health, Education, Institute",,,aimhs/american-institute-of-mental-health-studies,,0,Approved,$0,2,No,,,Mental Health,,2025-04-01T00:00:00Z,2025-04-01T00:00:00Z
,"AIMSS","American Institute of Medical Safety Studies","A U.S. institute for medical safety education. It promotes training in healthcare safety.","Safety, Medical, Institute",,,aimss/american-institute-of-medical-safety-studies,,0,Approved,$0,2,No,,,Medical Safety,,2025-04-01T00:00:00Z,2025-04-01T00:00:00Z
,"AINCS","American Institute of Nutritional Counseling Studies","A U.S. institute for nutritional counseling education. It supports training in dietary health.","Counseling, Nutrition, Institute",,,aincs/american-institute-of-nutritional-counseling-studies,,0,Approved,$0,2,No,,,Nutritional Counseling,,2025-04-01T00:00:00Z,2025-04-01T00:00:00Z
,"AINHS","American Institute of Natural Health Studies","A U.S. institute for natural health education. It advances teaching in holistic wellness.","Health, Natural, Institute",,,ainhs/american-institute-of-natural-health-studies,,0,Approved,$0,2,No,,,Natural Health,,2025-04-01T00:00:00Z,2025-04-01T00:00:00Z
,"AINSS","American Institute of National Safety Studies","A U.S. institute for national safety education. It promotes training in public security.","Safety, National, Institute",,,ainss/american-institute-of-national-safety-studies,,0,Approved,$0,2,No,,,National Safety,,2025-04-01T00:00:00Z,2025-04-01T00:00:00Z
,"AIOCS","American Institute of Occupational Counseling Studies","A U.S. institute for occupational counseling education. It supports training in workplace mental health.","Counseling, Occupational, Institute",,,aiocs/american-institute-of-occupational-counseling-studies,,0,Approved,$0,2,No,,,Occupational Counseling,,2025-04-01T00:00:00Z,2025-04-01T00:00:00Z
,"AIOHS","American Institute of Occupational Health Studies","A U.S. institute for occupational health education. It advances teaching in workplace wellness.","Health, Occupational, Institute",,,aiohs/american-institute-of-occupational-health-studies,,0,Approved,$0,2,No,,,Occupational Health,,2025-04-01T00:00:00Z,2025-04-01T00:00:00Z
,"AIOSS","American Institute of Operational Safety Studies","A U.S. institute for operational safety education. It promotes training in system safety.","Safety, Operational, Institute",,,aioss/american-institute-of-operational-safety-studies,,0,Approved,$0,2,No,,,Operational Safety,,2025-04-01T00:00:00Z,2025-04-01T00:00:00Z
,"AIPCS","American Institute of Public Counseling Studies","A U.S. institute for public counseling education. It supports training in community mental health.","Counseling, Public, Institute",,,aipcs/american-institute-of-public-counseling-studies,,0,Approved,$0,2,No,,,Public Counseling,,2025-04-01T00:00:00Z,2025-04-01T00:00:00Z
,"AIPHS","American Institute of Public Health Studies","A U.S. institute for public health education. It advances teaching in community wellness.","Health, Public, Institute",,,aiphs/american-institute-of-public-health-studies,,0,Approved,$0,2,No,,,Public Health,,2025-04-01T00:00:00Z,2025-04-01T00:00:00Z
,"AIPRS","American Institute of Public Relations Studies","A U.S. institute for public relations education. It supports training in communication strategies.","Public Relations, Education, Institute",,,aiprs/american-institute-of-public-relations-studies,,0,Approved,$0,2,No,,,Public Relations,,2025-04-01T00:00:00Z,2025-04-01T00:00:00Z
,"AIPSS","American Institute of Public Safety Studies","A U.S. institute for public safety education. It advances training in community security.","Safety, Public, Institute",,,aipss/american-institute-of-public-safety-studies,,0,Approved,$0,2,No,,,Public Safety,,2025-04-01T00:00:00Z,2025-04-01T00:00:00Z
,"AIRCS","American Institute of Rehabilitation Counseling Studies","A U.S. institute for rehabilitation counseling education. It promotes training for patient recovery.","Counseling, Rehabilitation, Institute",,,aircs/american-institute-of-rehabilitation-counseling-studies,,0,Approved,$0,2,No,,,Rehabilitation Counseling,,2025-04-01T00:00:00Z,2025-04-01T00:00:00Z
,"AIRHS","American Institute of Rural Health Studies","A U.S. institute for rural health education. It supports teaching in underserved healthcare.","Health, Rural, Institute",,,airhs/american-institute-of-rural-health-studies,,0,Approved,$0,2,No,,,Rural Health,,2025-04-01T00:00:00Z,2025-04-01T00:00:00Z
,"AIRSS","American Institute of Rehabilitation Safety Studies","A U.S. institute for rehabilitation safety education. It advances training in safe recovery practices.","Safety, Rehabilitation, Institute",,,airss/american-institute-of-rehabilitation-safety-studies,,0,Approved,$0,2,No,,,Rehabilitation Safety,,2025-04-01T00:00:00Z,2025-04-01T00:00:00Z
,"AISCS","American Institute of Supply Chain Studies","A U.S. institute for supply chain education. It promotes training in logistics management.","Supply Chain, Education, Institute",,,aiscs/american-institute-of-supply-chain-studies,,0,Approved,$0,2,No,,,Supply Chain,,2025-04-01T00:00:00Z,2025-04-01T00:00:00Z
,"AISHS","American Institute of Sports Health Studies","A U.S. institute for sports health education. It supports teaching in athlete wellness.","Health, Sports, Institute",,,aishs/american-institute-of-sports-health-studies,,0,Approved,$0,2,No,,,Sports Health,,2025-04-01T00:00:00Z,2025-04-01T00:00:00Z
,"AISSS","American Institute of Systems Safety Studies","A U.S. institute for systems safety education. It advances training in technical safety.","Safety, Systems, Institute",,,aisss/american-institute-of-systems-safety-studies,,0,Approved,$0,2,No,,,Systems Safety,,2025-04-01T00:00:00Z,2025-04-01T00:00:00Z
,"AITCS","American Institute of Transportation Counseling Studies","A U.S. institute for transportation counseling education. It promotes training in transport mental health.","Counseling, Transportation, Institute",,,aitcs/american-institute-of-transportation-counseling-studies,,0,Approved,$0,2,No,,,Transportation Counseling,,2025-04-01T00:00:00Z,2025-04-01T00:00:00Z
,"AITHS","American Institute of Technical Health Studies","A U.S. institute for technical health education. It supports teaching in healthcare technology.","Health, Technical, Institute",,,aiths/american-institute-of-technical-health-studies,,0,Approved,$0,2,No,,,Technical Health,,2025-04-01T00:00:00Z,2025-04-01T00:00:00Z
,"AITSS","American Institute of Transportation Safety Studies","A U.S. institute for transportation safety education. It advances training in transport safety.","Safety, Transportation, Institute",,,aitss/american-institute-of-transportation-safety-studies,,0,Approved,$0,2,No,,,Transportation Safety,,2025-04-01T00:00:00Z,2025-04-01T00:00:00Z
,"AIVCS","American Institute of Veteran Counseling Studies","A U.S. institute for veteran counseling education. It promotes training for veteran mental health.","Counseling, Veteran, Institute",,,aivcs/american-institute-of-veteran-counseling-studies,,0,Approved,$0,2,No,,,Veteran Counseling,,2025-04-01T00:00:00Z,2025-04-01T00:00:00Z
,"AIVHS","American Institute of Veterinary Health Studies","A U.S. institute for veterinary health education. It supports teaching in animal wellness.","Veterinary, Health, Institute",,,aivhs/american-institute-of-veterinary-health-studies,,0,Approved,$0,2,No,,,Veterinary Health,,2025-04-01T00:00:00Z,2025-04-01T00:00:00Z
,"AIVSS","American Institute of Volunteer Safety Studies","A U.S. institute for volunteer safety education. It advances training in safety for volunteer programs.","Safety, Volunteer, Institute",,,aivss/american-institute-of-volunteer-safety-studies,,0,Approved,$0,2,No,,,Volunteer Safety,,2025-04-01T00:00:00Z,2025-04-01T00:00:00Z